screen_name,in_reply_to_screen_name,mentions,full_text
TGdadon1,,[u'929TheGame'],RT Kamla Welcome to the Falcons Taylor Gabriel Big third down conversion 
TGdadon1,,[u'knoxbardeen'],RT Taylor Gabriel is a Kyle Shanahan receiver He's finally ready w/ the playbook &amp; could be big today 
TGdadon1,,[u'11AliveSports'],RT Welcome Taylor Gabriel We like you 
TGdadon1,,[u'SheScream_Nkosi'],RT Taylor Gabriel fast 
TGdadon1,,[u'TGdadon1'],RT You did great today Can't wait to see you put up some huge numbers for Atlanta 
TGdadon1,,"[u'jobbe03', u'TGdadon1']",RT First catch as a Falcons by for the first down 
TGdadon1,,"[u'AtlantaFalcons', u'TGdadon1']",RT First catch as a Falcon by and its a HUGE 3rd down catch 
TGdadon1,,[],first game as a falcon more W's to come felt good getting a win with my brothers 
TGdadon1,,[],God fearing man 
TGdadon1,,[],
TGdadon1,,[],
TGdadon1,,[],
TGdadon1,,[],
TGdadon1,,"[u'AtlantaFalcons', u'FalconsDQ', u'TGdaDon']",RT gave us the scoop on newly signed WR and man is he fast 
TGdadon1,,[],
TGdadon1,TravisBenjamin3,[u'TravisBenjamin3'],that's love fam 
TGdadon1,Hawk,[u'Hawk'],the Goat taught me a lot the period of time we played together thank you for the knowledge and showing me how to be a pro 
TGdadon1,,"[u'AtlantaFalcons', u'TGdadon1']",RT Falcons Claim Sign 7 to Practice Squad 
TGdadon1,,[],thanks again to Cleveland for the opportunity time to ball in ATL 
TGdadon1,,[],Blessed beyond TBT first time ever putting on a Browns jersey ready for what's to come 
TGdadon1,TonyGrossi,[u'TonyGrossi'],I'ma miss you grossi lol you gave me a hard time my rookie year lol 
TGdadon1,chase_enochs,[],smart man 
TGdadon1,,[u'ACUFootball'],RT Happy It is GAME DAY The Wildcats take on Air Force at 100 CT 
TGdadon1,joey_vozel,[u'joey_vozel'],me too 
TGdadon1,,[],Felt good to be back there deep again return 
TGdadon1,TheAnthonyBlack,[u'TheAnthonyBlack'],gotcha 
TGdadon1,,[],tuff loss tonight back to the grind 
TGdadon1,,[],
TGdadon1,,[],Happy Birthday family more then a teammate my brother 
thehawk38,,[u'EdWerderespn'],RT I saw you were Black Jersey Winner for your work prepping teammates Says a lot 
thehawk38,,[],OnlyUs 
thehawk38,,[u'BigSean'],RT stick to the plan stay focused 
thehawk38,,[],I know there's a lot of you out there mad at the position I'm in lol It's okthere will be better days 
thehawk38,BMeriweather31,[u'BMeriweather31'],appreciate you 
thehawk38,,[],The arrival 
thehawk38,,[],RT That time Goldson murdered Aaron Hernandez 
thehawk38,,[],
thehawk38,POParazzi,[u'POParazzi'],got eeeem 
thehawk38,BenjaminBoo1,[u'BenjaminBoo1'],yah me either 
thehawk38,,[u'UW_Football'],Ok so I been watching this game since started and was wondering when the game gonna start? 
thehawk38,MoranNorris,[u'MoranNorris'],slap diggady 
thehawk38,HoustonBates55,[u'HoustonBates55'],my boy Miss u too bro Hold it down 
thehawk38,,[],Woof woof 
thehawk38,,[],Dawgs lets goooooo Time to stand up 
thehawk38,ochocinco,[u'ochocinco'],we right up the street from serving spoon Called Smokings 6713 LA tijera Blvd Los Angeles CA 
thehawk38,,[],Rise up 
OfficialAJHawk,,"[u'alexmarvez', u'OfficialAJHawk', u'SiriusXMNFL']",RT Excited to co-host my first show with 7-11 pm ET tonight on 
OfficialAJHawk,ryan_gonzo,[u'ryan_gonzo'],Thanks I appreciate you listening I have some good ones coming up Give it a review on iTunes 
OfficialAJHawk,,[u'ryenarussillo'],Really good stuff from in here So cool to hear someone being so honest Thanks 
OfficialAJHawk,,[u'arielhelwani'],What a union could do for the fighters 
OfficialAJHawk,,[u'arielhelwani'],E97 Host of &amp; sharing stories and insight 
OfficialAJHawk,,[u'Bcarp3'],RT 
OfficialAJHawk,,"[u'ZigFracassi', u'OfficialAJHawk', u'SiriusXMNFL', u'SuperBowl', u'ProFootballHOF']",RT joins me now for The End Zone till 2 pm eastern on 88 &amp; talk 87 
OfficialAJHawk,,"[u'ZigFracassi', u'SuperBowl', u'OfficialAJHawk', u'SiriusXMNFL']",RT We'll preview the big game tomorrow w/@SuperBowl 45 champ noon-2 eastern on 88 
OfficialAJHawk,,[u'Bcarp3'],Jake Ballard has an awkward first day with the 
OfficialAJHawk,,[u'TheJakeBallard'],E96 Champ Hurt in Super Bowl- Claimed by Coughlin time 
OfficialAJHawk,,[],I Appreciate it Ariel you were great Will put the episode up for everyone soon 
OfficialAJHawk,,[],E95 Bob Costas sharing details from the Jerry Sandusky Interview At 4740 in full ep here 
OfficialAJHawk,,[],E95 Bob Costas 
OfficialAJHawk,,[u'RyanHawk12'],RT A huge honor to speak at my Dad's retirement celebration today More emotion (and tears) than 
OfficialAJHawk,,"[u'TheJonasKnox', u'3rd_Goal', u'OfficialAJHawk']",RT Facts only 
OfficialAJHawk,,"[u'FoxSportsRadio', u'Jason33887', u'TheJonasKnox', u'OfficialAJHawk', u'3rd_Goal', u'iHeartRadio']",RT Listen right here 
OfficialAJHawk,,"[u'TheJonasKnox', u'3rd_Goal', u'OfficialAJHawk', u'FoxSportsRadio', u'iHeartRadio']",RT Big Time Brother-in-Law Show coming up NEXT Join &amp; Myself on 
OfficialAJHawk,,[u'Ky1eLong'],RT Oh my god how will anyone involved ever recover from this slander Lmao 
OfficialAJHawk,,"[u'ProFootballDoc', u'SiriusXMNFL', u'OfficialAJHawk']",RT On next with &amp; to discuss Divisional Round injuries 
OfficialAJHawk,,[u'itsCrab'],E94 Tom Crabtree talks Hot Takes Concussions and Clemson Oil Checks 
OfficialAJHawk,,[u'johnelway'],I was with VJ in Cincy Great hire by Smart calculated creative defensive mind Holds guys accountable 
OfficialAJHawk,BenG_1994,[u'BenG_1994'],Thanks for listening Some good guests coming up as well 
OfficialAJHawk,,[],Yep out this week We will see if our title game predictions come true 
OfficialAJHawk,,"[u'SiriusXMCollege', u'HorowitzJason', u'OfficialAJHawk']",RT Hot Read What's the final score in tonight's 888-573-5335 
OfficialAJHawk,,[u'thecooleyzone'],Dude who wouldn't chub it up? 
OfficialAJHawk,,[u'thecooleyzone'],E93 Chris Cooley talks Joe Gibbs' Coaching Blogging Captain Chaos and more 
OfficialAJHawk,,[u'Brooksreed50'],Solid picture My hair looks good 
OfficialAJHawk,,[],Congrats to Marcus He will be a great coordinator Wayne high school alum 
OfficialAJHawk,,[],Yes Tough to get them but would be broadcast gold 
OfficialAJHawk,,"[u'SiriusXMCollege', u'HorowitzJason', u'OfficialAJHawk', u'GregMcElroy', u'MrCFB', u'Andy_Staples']",RT w/ &amp; is LIVE until 4pm ET Guests 
OfficialAJHawk,,[u'SiriusXMCollege'],The Silver Bullets have arrived Looking forward to watching a good one 
OfficialAJHawk,,"[u'PlayersTribune', u'OhioStateFB', u'OfficialAJHawk']",RT From one national champion to this years hopefuls game day message &gt; 
OfficialAJHawk,,"[u'MarkPacker', u'SiriusXMCollege', u'OfficialAJHawk']",RT Fun day ahead2 live shows from University of Phoenix Stadium(3-7pm &amp; 11p-1am ET) 
OfficialAJHawk,,"[u'CoachFick', u'SiriusXMCollege']",Good talk with the D coordinators for Saturday night Two highly respected coaches 
OfficialAJHawk,,[],Good to speak with both teams today Coaches and players all seem to be confident and relaxed heading into Saturday night 
OfficialAJHawk,,"[u'PlayersTribune', u'OfficialAJHawk', u'OhioStateFB']",RT In 2002 won a national title at Hes ready for that winning tradition to continue http 
OfficialAJHawk,,[],Mike Leach 
OfficialAJHawk,TJLang70,[u'TJLang70'],Appreciate it Congrats on the well deserved Pro Bowl 
OfficialAJHawk,,[u'BradyPoppinga'],Only if you are a regular caller We can talk preseason games and how important you believe they are 
OfficialAJHawk,,[],11-3 eastern Solid lineup of guests today 
OfficialAJHawk,,[],22min in Joe talks about his World Series future 
OfficialAJHawk,,[u'Bcarp3'],Props to the guy that copy and pasted height and weight for me 
OfficialAJHawk,,[u'Buck'],E92 is back and we're talking about his book Listen in here 
OfficialAJHawk,,"[u'SiriusXMCollege', u'MarkPacker', u'OfficialAJHawk', u'BUFootball', u'SethOnHoops']",RT w/ &amp; is on til 7p ET HC Jim Grobe and will j 
OfficialAJHawk,,"[u'MarkPacker', u'OfficialAJHawk', u'SethOnHoops', u'SiriusXMCollege']",RT co-hosts todayguests include Jim Grobe and It all gets started at 4pm 
OfficialAJHawk,,"[u'NBCSportsRadio', u'OfficialAJHawk', u'Rodney_Harrison']",RT Listen for sitting in for on The Safety Blitz this weekend on 
OfficialAJHawk,,[],E91 Josh Sitton On iTunes Now 
OfficialAJHawk,,[],
OfficialAJHawk,,[],E91 Josh Sitton All-Pro guard From to 
OfficialAJHawk,,"[u'SiriusXMCollege', u'HorowitzJason', u'OfficialAJHawk']",RT w/ &amp; is LIVE NEXT Guests 
OfficialAJHawk,,[],Looking forward to the show today 
OfficialAJHawk,,[],Great hire by the Bearcats Luke is one of the most respected coaches I've ever been around All around great human 
OfficialAJHawk,cooop14,[u'cooop14'],Checkout episode 10 from a while back for Herbstreit Sam Ponder would be a great guest Thanks for listening 
OfficialAJHawk,,[u'DougDatish'],RT New landing page and logo Put in your email to get the latest updates and if you or a loved one needs help 
OfficialAJHawk,,[u'HOMAGE'],RT Happy birthday to a Penguin Buckeye and one heck of a coach 
OfficialAJHawk,,[u'JLaurinaitis55'],Unforgettable moments here 
OfficialAJHawk,,[u'JLaurinaitis55'],E90 is up 
OfficialAJHawk,,[u'JLaurinaitis55'],E90 Goes live tomorrow Subscribe here now 
OfficialAJHawk,NFLNnewsdesk,[u'NFLNnewsdesk'],Yes 
OfficialAJHawk,,[],The tent is used for a bathroom breaks and privacy when you need trainers to wrap/check on injury 
OfficialAJHawk,,[],The ref saw his mouthpiece on the facemask and charged timeout Don't wear a mouthpiece ever and refs won't notice 
OfficialAJHawk,,[],
OfficialAJHawk,,[u'Onnit'],Get stuff like this Black Friday sale all weekend 
OfficialAJHawk,,"[u'DougDatish', u'OfficialAJHawk']",RT &amp; I discuss The Game CBUS eateries &amp; other nonsense 
OfficialAJHawk,,[u'MikeNolanNFL'],E89 on referring Singletary in SF at 4055 
OfficialAJHawk,,[u'JeffDarlington'],The Infamous 
OfficialAJHawk,,[u'MikeNolanNFL'],E89 on handling the media being a good soldier final days in SF and drafting Alex Smith 
OfficialAJHawk,,[u'WillAllenWAF'],Total lack of awareness Damage is already done retraction won't be seen by the masses@WillAllenWAF is a good guy and great teammate 
OfficialAJHawk,,[u'Onnit'],Huge Black Friday coming for 
OfficialAJHawk,,"[u'Todd_Blackledge', u'CoachFick']",Great to see give some good pub on the broadcast Ultimate respect for my old coach 
OfficialAJHawk,,[u'PetrosAndMoney'],Looking good in the official shirt Thanks for coming on the podcast 
OfficialAJHawk,,[u'BarstoolBigCat'],RT 
OfficialAJHawk,,"[u'ZigFracassi', u'OfficialAJHawk', u'SiriusXMNFL', u'dhagan80', u'geoffschwartz', u'MikeCareyRef94']",RT joins me for The End Zone 7-11 pm est Guests &amp; 
OfficialAJHawk,,"[u'SiriusXMNFL', u'ZigFracassi', u'TheGarden']",Saturday 7-11 eastern 88 Talk football before the main event of 
OfficialAJHawk,,[],E88 Mike Leach talking PC Culture and Price is Right Coin Tosses 
OfficialAJHawk,JoeManganiello,[u'JoeManganiello'],Joe Would love to have you on my podcast Could talk Steelers Batman workouts 
OfficialAJHawk,,"[u'theimpactmike', u'OfficialAJHawk', u'JimTressel5', u'OhioStateFB']",RT All of coaches impacted him positively Here's what he said about from https/ 
OfficialAJHawk,,[u'ShowtimeTate'],Walk off TD by is unreal Respect the ball security to come down with it 
OfficialAJHawk,sdubois849,"[u'sdubois849', u'FS1', u'PetrosAndMoney', u'JustinKutcher']",Thank you and helped a lot I enjoyed it and hope to call more games 
OfficialAJHawk,,"[u'FS1', u'JustinKutcher', u'PetrosAndMoney']",My view today on the farm 330 eastern Calling the game with 
OfficialAJHawk,,"[u'Theoldp', u'PetrosAndMoney', u'FS1']",E87 w/@Theoldp of is on iTunes Subscribe 
OfficialAJHawk,,"[u'PetrosAndMoney', u'FS1']",E87 Co-host Petros Papadakis in the booth w/me Sat vs 
OfficialAJHawk,,[u'Sia'],
OfficialAJHawk,,[],John Hicks and Jack Tatum spoke to the team after practice years ago Their love and passion for OSU football is unmatched RIP 
OfficialAJHawk,,[u'AmyJoMartin'],Declared 3rd Most Powerful Woman on Twitter by Forbes sharing knowledge 
OfficialAJHawk,,[u'NFLFilms'],Anything with Pat is must watch in the Hawk household Huge respect to the whole Tillman family 
OfficialAJHawk,,[u'AmyJoMartin'],E86 NY Times Best-Selling Author and Founder of Digital Royalty sharing knowledge 
OfficialAJHawk,,[u'AmyJoMartin'],After a brief hiatus the podcast is back tomorrow with Let me know who you want to hear from on the show 
OfficialAJHawk,,[],Good to be here 
OfficialAJHawk,,"[u'BradyPoppinga', u'AaronRodgers12']",E85 is up with telling stories and a surprise visit from 
OfficialAJHawk,,"[u'BradyPoppinga', u'AaronRodgers12']",Subscribe for the full episode out Tuesday and his stories Surprise visit from 
OfficialAJHawk,,"[u'BradyPoppinga', u'AaronRodgers12']",E85 Preview gets a surprise visit from Subscribe full episode Tuesday 
OfficialAJHawk,,[u'BCusterTV'],Appreciate it Thanks for bringing the energylet's do it again soon 
OfficialAJHawk,,[u'Andrea_Kremer'],My job is to elicit your best response E84 
OfficialAJHawk,,"[u'PeterRank', u'weirnateatc']",is the man with the 32 ounce solo cups He sent them to me strictly for podcasting 
OfficialAJHawk,,[u'Andrea_Kremer'],Story time with 
OfficialAJHawk,,"[u'nflnetwork', u'Andrea_Kremer']",Very grateful to have Emmy-Award winning and Chief Correspondent on E84 here 
OfficialAJHawk,,[u'AdamSchefter'],Story below continues at 1750 mark here 
OfficialAJHawk,,[u'AdamSchefter'],iTunes link for episode 
OfficialAJHawk,,[u'AlbertBreer'],RT Petrino rides again 
OfficialAJHawk,JPeanasky,[u'JPeanasky'],I agree stay tuned This week Andrea Kremer episode will be out 
OfficialAJHawk,,"[u'gmfb', u'wolfblitzer', u'buffalobills']",Good times on Would have loved to stay around for Respect his passion for 
OfficialAJHawk,FootballExpert,"[u'FootballExpert', u'AlbertBreer']",Dr Drew would beg to differ 
OfficialAJHawk,,[],Joe Kane couldn't handle his booze Both he and Mox's dad were drunks Mox overcame love the underdog story 
OfficialAJHawk,,[u'AdamSchefter'],A 9/11 Story E83 w/@AdamSchefter watch 
OfficialAJHawk,,[u'AdamSchefter'],More details surrounding the 9/11 story by Subscribe here 
OfficialAJHawk,,[u'CardsMarkD'],RT Worth 62 seconds of your time this AM Pat Tillman the day after 9-11 
OfficialAJHawk,,"[u'BarstoolBigCat', u'OfficialAJHawk']",RT Thanks again to for coming on the show and talking memories Link here 
OfficialAJHawk,,"[u'PardonMyTake', u'BarstoolBigCat', u'PFTCommenter']",PART 2 of the swapcast with 
OfficialAJHawk,,"[u'BarstoolBigCat', u'OfficialAJHawk']",RT Tomorrow on Pardon My Take we're doing a same day home and home with and his 'cast it's poppin' https 
OfficialAJHawk,,"[u'DougDatish', u'HuddleNetwork']",RT Our thoughts on the BG game and other fun stuff@justinzwick12 
OfficialAJHawk,,[u'Cabbie'],Short cut of sharing a story Watch the uncut version here 
OfficialAJHawk,,[u'Cabbie'],E81 Mastering Unusual A-List Interviews 
OfficialAJHawk,,[],Spurrier killing it at 71 years old 
OfficialAJHawk,,[u'Coach_Fleck'],Congrats to Have to respect the passion 
OfficialAJHawk,,[],
OfficialAJHawk,,[],Always a good time on 
AustinHooper18,,[u'StanfordFball'],RT Most alumni on NFL rosters (total/active) remaining in Playoffs STANFORD (11/8) Alabama (7/5) LSU/Miami (6/5) Auburn 
AustinHooper18,,[u'TeamFA'],RT Muhammad Ali would have turned 75 today RIP The greatest 
AustinHooper18,,[u'BenGarland63'],RT Sack/safety let all the glory be to God 
AustinHooper18,TeagenConway,"[u'TeagenConway', u'shunboi']",ther we go I was watching espn hd where they have the film room 
AustinHooper18,JLeon253,[u'JLeon253'],i wish brotha All analysis people since everybody tuned in for the reporters and stats 
AustinHooper18,,[u'AtlantaFalcons'],RT The division is ours Tickets 
AustinHooper18,,[u'Big75Fella'],RT MoodAGAIN 
AustinHooper18,,[u'TGdadon1'],RT What a Win today 
AustinHooper18,,"[u'JacobTamme', u'LevineToilolo', u'AustinHooper18']",RT Your TD seems like it was 15 hrs ago but I SEE YOU And I SEE YOU TEs represent 
AustinHooper18,,"[u'DocPreston', u'dlsathletics', u'AustinHooper18', u'MVPWard']",RT Nice day and Well done 
AustinHooper18,,[u'BleacherReport'],RT Randy Moss is as confident as ever 
AustinHooper18,,"[u'StanfordFball', u'NFL']",RT Fifth straight year has recognized Stanford as with the most TEs on active rosters https 
AustinHooper18,,"[u'Rell_TooReal', u'AustinHooper18']",RT I see you boy 
AustinHooper18,,"[u'ESPNNFL', u'StanfordFball']",RT teammates Andrus Peat and Austin Hooper with the jersey swap 
AustinHooper18,,[u'CauseWereGuys'],RT If you didn't spend countless hours playing on this rug you're not a 90s kid 
AustinHooper18,,[],RT THat Part 
debo,,[],NOLA STAY STRONG 
debo,,[u'CurrenSy_Spitta'],RT Don't trip Atlanta y'all got hella bitches and that lil hood Chinese food place in Lennox food court Y'all the t 
debo,,[],
debo,,[],
debo,,[u'500LEVEL'],Check out 
debo,,[],Dreams Come True 
debo,,"[u'RicFlairNatrBoy', u'AtlantaFalcons']",RT PSA 
debo,,[u'wizkhalifa'],Most Of Us Got Our Change Up Never Changed Up 
debo,,[],It's Only Right We Ain't Going Nowhere 
debo,JayCar_11,"[u'JayCar_11', u'Self_Made8_']",
debo,,[u'raylewis'],RT don't be upset with the results you didn't get with the work you didn't do 
debo,aaryont,"[u'aaryont', u'raylewis']",Appreciate it 
debo,,[],I Have The Scars To Show For Everything I Have 
debo,,[u'WhoDatNOLA1025'],RT Everyone go vote for LSU football's for NFL Rookie of the year 
debo,,[],YESSUHHH 
debo,,[u'ATLSPORTSHUB'],RT Matt Ryan for ----- Give him a retweet to make it happened 
debo,,[],You Live You Learn 
debo,greengoblin,[u'mills_island'],you right 
debo,,[],Wazzam Doe 
debo,,[u'SlopingGiraffe'],RT 
debo,,[],Can't Afford Mistakes Not On This End 
debo,,[u'llerudesigns'],RT 
debo,,[],Great Road Win One More To Go 
debo,,[u'Heezy_PackyYow'],RT Shout out for dropping this gem in the latest Mic'd Up episode of 
debo,,[u'1Goal1Dream'],RT I really love the way &amp; playing This isn't a mistake is the new 
debo,,"[u'Cody_Fox5', u'FOX5Sports']",RT win 41-13 &amp; Deion Jones making Christmas wishes come true 
debo,,[u'LaBellaJmarie'],RT Cuteness OVERLOAD My sunshine and her parrain 
debo,,[u'ljakes22'],RT doing big things in this 1st quarter Must be the 
debo,,[],It's More Than Ball It's Family 
debo,,[u'AtlantaFalcons'],RT GO DJ That's my DJ Rookie Deion Jones intercepts Goff for his second PICK-SIX on the year ht 
debo,,[u'GreatBambino__'],RT &amp; Some Real GOONZ On The Field 
debo,,[u'llerudesigns'],RT BEAUTY&amp;PAIN VERY VERY SOON 
debo,,[],Never Switch Up 
debo,,[u'Raising_Canes'],Maaaaaaaannnnn I Wish I Could Have Some 
debo,,[],
debo,Taki_K,[u'Taki_K'],
debo,,[],Yeah We Heard All ThatNow It's Time To Live That Happy Senior Night My Boys 
debo,,[u'Blessedagentrb'],RT Only let paper chasers dwell in this vicinity 
debo,,[u'Blessedagentrb'],RT DEVOTED in EVERYTHING 
debo,,[u'OrbitGum'],RT Just be sure to keep some for yourself Best wishes for the rest of the season 
debo,FalconpunchATL,[u'FalconpunchATL'],POPEYES 
debo,,[],Another Piece Missing 
debo,noceilings27,[u'noceilings27'],
debo,,[u'LSUfootball'],RT Beckwith Named Semi-finalist for Butkus Award Story 
debo,,[u'OrbitGum'],Im helping the kids on Halloween Thanks 
debo,,[],This For All The Rejects The Ones Who Was Slept On 
debo,,[],For Them I'll Risk It All 
debo,,[],Feel Good To Be Apart Of Something Special 
debo,,[],Every Time I Signed Up For The Frontline 
debo,greengoblin,[u'mills_island'],
debo,,[],Nothing But God 
debo,,[],There Were Times I Doubted With Them 
debo,,[],Blessings Come Down 
debo,,"[u'LSUfootball', u'ABC']",RT We're in this together LSU v Wisconsin Sept 3 236 pm CT Lambeau https 
debo,,[],RT September 16th my birthday on the lens and edit 
Josh__Keyes,,[],Lost the big one and there are still people lining the roads waving rise up flags and honking car horns So much respect ATL best fans 
Josh__Keyes,,[u'M_Ryan02'],Congrats to ice on the MVP award Lets go finish business tomorrow 
Josh__Keyes,,[u'BleacherReport'],RT BREAKING Michael Vick has officially retired from the NFL 
Josh__Keyes,,[],RT Jus because you don't get or understand a person doesn't mean they're crazystop calling ppl crazy I have yet to kno w 
Josh__Keyes,CanOfWhoopAssss,[u'CanOfWhoopAssss'],yes very aware One of my good friends and I are fans of his work 
Josh__Keyes,,[],I bet you wouldn't of guessed that More than an athlete 
Josh__Keyes,Kvmrin,[u'Kvmrin'],facts 
Josh__Keyes,,[],518 kids at media day 
Josh__Keyes,,[],Best fans in the NFL Off to Houston 
Josh__Keyes,,[],My 11th grade English teacher said my writing was no good so I majored in English 
Josh__Keyes,,[],JJ put some meat on them bones I guess he think he a hitter now he up next 
Josh__Keyes,,[],Tuned in to watch my youngest son show out at the 
Josh__Keyes,,[],appreciate you bro 
Josh__Keyes,k__h__r,[u'k__h__r'],
Josh__Keyes,,[],RT One more road to cross 
Josh__Keyes,,[],
Josh__Keyes,,[],Thank you 
Josh__Keyes,,[],Headed to the ship Love my brothers 
Josh__Keyes,,[],It's almost that time 
Josh__Keyes,,[],Keeping it loose and trusting in the process 
Josh__Keyes,,[],Dear Twitter fam I appreciate all of the love Y'all are awesome I hope to see yall at the game on Sunday Sincerely 52 
Josh__Keyes,MUTBETSPS4,[u'MUTBETSPS4'],Haha hey what's up? 
Josh__Keyes,,[],Ayy Fam 
Josh__Keyes,cheebaweeba,"[u'cheebaweeba', u'VicBeasley3']",Thank you 
Josh__Keyes,FlydottU,[u'FlydottU'],Hey what's good? 
Josh__Keyes,ButterfliiWingz,"[u'ButterfliiWingz', u'VicBeasley3']",Brotherhood till the end 
Josh__Keyes,,[u'devontafreeman'],RT Let no man pull you so low as to hate him -#MLK 
Josh__Keyes,,[],What a game 
Josh__Keyes,,[u'AtlantaFalcons'],Winner winner Seahawk dinner NFC championship here we come 
Josh__Keyes,,[u'VicBeasley3'],My man Vic is having himself a season 
Josh__Keyes,,[],
Josh__Keyes,,[],Thank you Obama's Thank you 
Josh__Keyes,,[],
Josh__Keyes,,[],Roll to bed bama fans The ACC lives 
Josh__Keyes,,[],ACC boy at heart 28-24 
Josh__Keyes,,[],RT I remember when they counted me out 
Josh__Keyes,,"[u'agility76', u'Twitter', u'Josh__Keyes']",RT Welcome back to 
Josh__Keyes,k__h__r,[u'k__h__r'],Planning a trip for the 1st weekend 
Josh__Keyes,,[],This USC freshmen QB is the real deal Sheeesh 
Josh__Keyes,,[],Sorry to say but we were all tricked Ronda Rousey is a wildly overrated mma fighter Great athlete but so one dimensional 
Josh__Keyes,,[],Decided to hop back on Twitter What's up Twitter world lol 
alexmack51,,[u'OfficialNFLShop'],Help this man 
alexmack51,,[],Ya whatever this says 
alexmack51,,"[u'katielevitre', u'FalconsDQ', u'AtlantaFalcons']",RT Thank you &amp; the organization for the amazing game ball I was presented We are SO lucky to be 
alexmack51,,[],Oline Brothership 
alexmack51,,"[u'joethomas73', u'alexmack55', u'TGdadon1', u'Browns']",RT Congrats to and on making the will know what this feels like nex 
alexmack51,,[],Wait isn't that the guy from Shawshank Redemption? Thanks for the work Thatch 
alexmack51,joethomas73,[u'joethomas73'],Die Hard takes 5th place 
alexmack51,,[],Woot 
alexmack51,,[u'alexmack55'],RT signed were worn in support of the Cure Tay-Sachs Foundation Bid now 
alexmack51,,"[u'MRochman12', u'alexmack55']",RT Shout out to thank you for helping spread Tay-Sachs awareness 
alexmack51,,[],Amazing talk 
alexmack51,,[],Pregame mosh pit? How is this not more common? 
alexmack51,,[u'McMurphyESPN'],RT Best bobblehead of all time for tonight's Washington at Cal game Marshawn Lynch driving an injury cart 
alexmack51,,[u'SPORTalkFalcons'],RT Freeman has been sharing the wealth when he scores Which lineman has the better spike? RETWEET for Alex Mack FAV fo 
alexmack51,,[u'SportsCenter'],RT Josh McCown has jokes 
alexmack51,GeorgiaPower,"[u'GeorgiaPower', u'M_Ryan02']",You told me I was gonna be the mulch man 
alexmack51,,"[u'TheBenchCal', u'MoneyLynch']",RT Come find at the Cal student store showing off his new Cal/BeastMode clothing line 
alexmack51,,[u'CBSSports'],RT This entrance wasnot ideal 
Keanu_Neal,,[u'Snugglett2007'],RT 
Keanu_Neal,,[u'AtlantaFalcons'],Check out the special team set Available for a limited time 
Keanu_Neal,,"[u'AtlantaFalcons', u'PaniniAmerica']",Were together on the field Were together in this special set from too 
Keanu_Neal,,[],Ain't over yet 
Keanu_Neal,,[u'AtlantaFalcons'],RT Aaron Rodgers on Keanu Neal He does a lot of things out there that makes you think hes a veteran MORE 
Keanu_Neal,,[],One more in the dome Blessings 
Keanu_Neal,,[u'GatorsFB'],RT Florida had four interceptions returned for touchdowns in 2016 which is its most since 2010 h 
Keanu_Neal,,[],
Keanu_Neal,,[],Love my team 
Keanu_Neal,JayCar_11,[u'JayCar_11'],tireddd boss 
Keanu_Neal,SlopingGiraffe,[u'SlopingGiraffe'],great vid 
Keanu_Neal,,[u'GatorsEquipment'],Thank you for the gear today Always appreciated 
Keanu_Neal,Snugglett2007,[u'Snugglett2007'],Was my pleasure Can't thank you enough for all your family has done for this country 
Keanu_Neal,,"[u'Snugglett2007', u'Keanu_Neal']",RT Thank you for honoring my husband SSG Darren Hubbell Taking the time to learn a little bit about him meant 
Keanu_Neal,,"[u'osgators', u'Keanu_Neal']",RT Former S saw in hard-nosed C TJ McCoy what opponents are seeing now 'He has some dog in him' 
Keanu_Neal,,"[u'AtlantaFalcons', u'Keanu_Neal']",RT Rookie has made a huge impact thus far this season but he's only getting started FULL CONVERSATION ht 
Keanu_Neal,,[],
Keanu_Neal,,[u'GatorsFB'],fans Get ready for Florida St- Nov 26 Get your Own the State tee at Gator Sports Shop in Gainsville 
Keanu_Neal,,[],Never do I intentionally hit someone in the head I'm not that kind of player Tough loss today but we'll be back 
Keanu_Neal,,"[u'NFLNow', u'BuckyBrooks', u'sterl_shep3']",RT Top 10 Rookies 9 8 Laremy Tunsil 7 6 5-1 
Keanu_Neal,,"[u'JayCar_11', u'Keanu_Neal']",RT Lit 
Keanu_Neal,32Dirtybird,[u'32Dirtybird'],that was my roommate in college Awesome dude 
Keanu_Neal,,[u'EXOSLEEVE'],Proud to be the new Brand Ambassador for official announcement here 
