screen_name,in_reply_to_screen_name,mentions,full_text
HDouglas83,DatNiggaPounD,[u'DatNiggaPounD'],no he ran for 1st downs &amp; made them bcuz of his size &amp; strength 
HDouglas83,DatNiggaPounD,[u'DatNiggaPounD'],against Bama &amp; Oregon the size speed power &amp; not to mention arm strength to extend plays &amp; run over defenders for 1st downs 
HDouglas83,,[],I wonder what Ohio State will do with the QB a situationI don't think Ohio State beats Wisconsin Alabama or Oregon without 12-gauge at QB 
HDouglas83,AshDanielle85,[u'AshDanielle85'],Ash I amI love the underdog ALWAYS 
HDouglas83,JayTriples,[],ya feel me 
HDouglas83,,[],A BIG drive by Ohio StateStarting inside your own 5 yard lineCLUTCH drive 
HDouglas83,,"[u'Kydmcgee15', u'HDouglas83']",RT I wanna meet one of my favorite wrs on Atlanta 
HDouglas83,Aljones894,[u'Aljones894'],at home right now working out 
HDouglas83,,[],The GOAL is to get/be better EVERYDAY 
HDouglas83,,[],That was a heck of a throw by A Luck 
HDouglas83,,[],Had a great time tonight at Hal's Steakhouse conversing with Brad NesslerGreat guy 
HDouglas83,,[u'newATLStadium'],Today I had the honor of touring at the Preview Center Unbelievable experience Love at first sight 
HDouglas83,,[],Up &amp; making moves in this cold weather 
HDouglas83,,[],Trying to decide should I blast the heat turn on the heat blanket &amp; start up the fireplaces at homeCOLD 
HDouglas83,onerealchris,"[u'onerealchris', u'TailgateTeam']",no 
HDouglas83,,[u'TailgateTeam'],Had a great time tonight at Publix with Thanks to all fans who came out &amp; supportedLove you all 
HDouglas83,,[],Love the daily messages from my mother 
HDouglas83,,"[u'680thefrontrow', u'MrCFB', u'HDouglas83']",RT Gotcha covered today -920 CFB Championship w/ -1020 Smoltz 1st ballot HOFer? W/Don Sutton -1120 
HDouglas83,,[u'Creflo_Dollar'],RT Whatever you focus on you give strength to If you focus on your weaknesses and failures you strengthen them to come a 
HDouglas83,,[],Why u gotta playa hate me like that &amp; I'm not a playa I just crush a lot-Stuart ScottThese are my favorite from Stuart Scott on SC 
HDouglas83,,[u'SportsCenter'],Growing up I watched just to see &amp; hear Stuart ScottI woke up every morning to smileRIP I will always have those memories 
HDouglas83,,[],I advise everyone to go see the movie SELMAIt was very well put togetherThe actors were amazingI love history 
HDouglas83,,[],Movie date todayGoing to see SELMA 
HDouglas83,,[],Ballgame over 
HDouglas83,,[],FSU making mistakes OREGON are capitalizing off of ALL of themAnd they waist no time doing it 
HDouglas83,,[],That was a BIIIIGGGGG drive by FSUEven bigger bcuz they get the ball to start the 2nd half 
HDouglas83,,[],FSU is moving the ball easy just have to score TD's 
HDouglas83,,[],Miss int &amp; missed sack usually turns into points for the offense 
HDouglas83,,[],Florida State or Oregon who yall have winning???? 
HDouglas83,,[],Headed to church to bring in the New Year 2015 
HDouglas83,,[],I'm guessing TCU has a BIG argument not to be in the final 4They putting up points 
HDouglas83,,[],Not going to lie CHUBB is a beast &amp; the SEC has a lot deal with for two more years while he's there 
HDouglas83,,[],My goodness 
HDouglas83,,[u'Atlsportsnate'],that was crazy 
HDouglas83,,[],That's just not smart as a defender on 4th down 
HDouglas83,,[],Here we go LOUISVILLE 
HDouglas83,,[],If you're struggling to forgive here's an amazing scripture 
HDouglas83,,[],Better QB play is going to boost us this half 
HDouglas83,BradGamel,[u'BradGamel'],dude let it go u living in the past 
HDouglas83,,[],A better 2nd half is coming 
HDouglas83,,[],Big stop by our DEFENSE right thereBig stop 
HDouglas83,willymac21,[u'willymac21'],LOUISVILLE Alum look up your facts 
HDouglas83,,[],Hit him hard hit him hard 
HDouglas83,,[],TD Louisville don't count your chickens before they hatch UGA fans 
HDouglas83,,[u'Atlsportsnate'],
HDouglas83,,[u'Atlsportsnate'],go U of L 
HDouglas83,,[],Go U of L 
HDouglas83,AkeemDent,[u'AkeemDent'],please stop it 
HDouglas83,,"[u'clutch_6', u'Uno1Siete7']",Big day today Let's eat AFROS 
HDouglas83,,[],Thank GOD for waking me up todayGAME DAY 
HDouglas83,,[u'SInow'],RT You know it's an awesome basketball game when Jennifer Lawrence shows up to support 
HDouglas83,deionbranch84,[u'deionbranch84'],YEAAAAAA it's time to show the world what time it is today LOUISVILLE ALL DAY &amp; NIGHT 
HDouglas83,,[],Family movie time 
HDouglas83,,[],Merry Christmas to everyone 
HDouglas83,LarrySlackjr,"[u'LarrySlackjr', u'HDouglas83', u'SteveEZV']",We are now officially ready for game day 
HDouglas83,jswilburn00,"[u'jswilburn00', u'929TheGame', u'TDBFoundation']",thank u also Mr Joe for always supporting us 
HDouglas83,CYNNEFOX5,"[u'CYNNEFOX5', u'HDouglas83', u'FOX5Atlanta']",Kudos to who provided haircuts and toys for kids today much love 
HDouglas83,,[u'TDBFoundation'],Kicking off our 6th Annual Holiday Treat Festival 
HDouglas83,,[u'TDBFoundation'],Today &amp; myself host 6th Annual Holiday Treat FestivalGiving out toys bikes haircuts &amp; live entertainment to over 800 kids 
HDouglas83,CallMe_2Short,[u'CallMe_2Short'],u can take them up there around 1045am 
HDouglas83,rconway8,[u'rconway8'],come downstairs &amp; say hello 
HDouglas83,IcecoldPhlyer,"[u'IcecoldPhlyer', u'HDouglas83']",growing up in Georgia playing for the home team at the highest levelyou sir are living the life BLESSED 
HDouglas83,,[],Great team win I'm tired but I left it all out on the field 
HDouglas83,,[],Thank GOD for waking up this morningGAME DAY Falcons vs Saints 1pm 
HDouglas83,,[],Be PATIENT &amp; remain HUMBLEThis rest will take care of itselfJames 410 &amp; Hebrews 1036 
HDouglas83,,[],Thank GOD for waking me up this morningGAME DAY Falcons vs Steelers 1pm 
HDouglas83,,[],Nap time for me 
HDouglas83,RotherSlam,[u'RotherSlam'],haha 
HDouglas83,DjShockley3,"[u'DjShockley3', u'PastorTroyDSGB']",lol u ah fool 
HDouglas83,DjShockley3,"[u'DjShockley3', u'PastorTroyDSGB']",SHOCK I been waiting for this day to comeLuckily for yall it didn't happen while I was in school 
HDouglas83,PastorTroyDSGB,[u'PastorTroyDSGB'],PT u kno what it is UGA don't stand ah chance 
HDouglas83,ThomasDavisSDTM,[],U of L vs UGAMy Louisville Cardinals all day everyday 
HDouglas83,,"[u'929TheGame', u'HDouglas83', u'MorningShow929']",RT joins the now to discuss the status of the Falcons as well as his personal projects in the com 
HDouglas83,,[],Great time &amp; great night 
HDouglas83,,[],All students have scholarships to go to collegeI'm sooooo proud of all of them 
HDouglas83,,[],AMAZING students at Carver High SchoolHonor Roll studentsHappy I could reward them with a wonderful dinner 
HDouglas83,,[],GAME DAY Falcons vs Packers 830pm Monday Night Football 
HDouglas83,,[],South-side 
HDouglas83,,"[u'nflplay60', u'DonorsChoose']",Help Morrow Elementary in Atlanta earn a fully funded project in the Showdown Vote here 
HDouglas83,roddywhiteTV,"[u'roddywhiteTV', u'LarryFitzgerald']",I know big brah I tip my hat off to you &amp; UAB 
HDouglas83,,"[u'beefybeffy', u'HDouglas83']",RT Thank you &amp; for turning this otherwise terrible week around 
HDouglas83,,"[u'JLaniseMcLean', u'HDouglas83']",RT So excited I got to meet 
HDouglas83,,"[u'KayemFranks', u'SkyViewAtlanta']",Took the final winners of the scavenger hunt on a ride Great night 
HDouglas83,,[],I'm honestly having a GREAT time doing this scavenger hunt 
HDouglas83,,[u'AtlanticStation'],RT You never know when superstar will drop by 
HDouglas83,,"[u'MissAtlFalcons', u'HDouglas83']",RT Wish I could write ur name on the pro bowl ballot U deserve 2B nominated Ur contribution is noticed 
HDouglas83,,[],Last spot An attraction near the Dome where you can see all of Atlanta from Come find me 
HDouglas83,,"[u'emilykcorley', u'HDouglas83']",RT Just won two incredible Falcons tickets from 
HDouglas83,,[],Next clue a performance spot on Peachtree 
HDouglas83,,[],First winner was waiting 2 more tix until we head to the next spot 
HDouglas83,,[u'AtlanticStation'],Lots of right guesses Who will be the first to find me in 
HDouglas83,,[],Workin through this Atlanta traffic but almost to our next stop Has anyone guessed yet? 4 more tix to give away 
HDouglas83,,[],Finishing Up at Lenox Next clue another shopping and restaurant spot but outdoors eat play live 
HDouglas83,,[],Who guessed right? I'm at Lenox 4 tix to the Pittsburgh game for the first fans to find me 
HDouglas83,,[],I have four(4) tickets for EACH location you guys find me atYou must show me your clue when you get here 
HDouglas83,,[],It's the holidays Come find me at 5 pm at the best mall in Atlanta 
HDouglas83,,[],Ready for the first clue? 
HDouglas83,,[],Doing a scavenger hunt tonight in ATL Find me 4 spots in the city with tickets to the Pittsburgh game Clues to start later 
HDouglas83,JayAdamsDigital,[],lol lol not this oneU better tell them my suit game serious 
HDouglas83,,[u'KayemFranks'],RT Yo -- scavenger hunt alert 4 clues 4 chances to win tix &amp; meet Follow 
HDouglas83,,[],FSU are defending Champs only unbeaten team &amp; just winsBut they're ranked 4thTCU lost to Baylor but they're 3rd &amp; Baylor 6th CRAZY 
HDouglas83,,[u'MikeJenk84'],Running Alma Mater off the court early 
HDouglas83,,[],Louisville vs Ohio State college basketballLive on ESPN 
HDouglas83,MikeJenk84,[u'MikeJenk84'],psssssshhhhhh 
HDouglas83,,[u'KayemFranks'],Tomorrow I'm doing a scavenger hunt around Atlanta w/ I'll have tickets to give away Clues start 4 pm 
HDouglas83,,"[u'KayemFranks', u'HDouglas83']",RT Hey -- Join our scavenger hunt with to win tix Follow us and for clue 
HDouglas83,ToddMcclure62,[u'ToddMcclure62'],thanks mud duck 
HDouglas83,,[],My nephew(Caleb) &amp; myself after our WIN today 
HDouglas83,,[],GREAT team win today 
HDouglas83,,[],GAME DAY Falcons vs Cardinals 405pmLeeeeggggoooo 
HDouglas83,,[u'TDBFoundation'],We are ready to serve mentor &amp; give our services to others volunteers 
HDouglas83,iHeartMiko,"[u'iHeartMiko', u'CoreyPeters91']",LOUISVILLE 
HDouglas83,,[],LOUISVILLE LOUISVILLE LOUISVILLE LOUISVILLE LOUISVILLE LOUISVILLE all day EVERYDAY 
HDouglas83,iHeartMiko,"[u'iHeartMiko', u'CoreyPeters91']",UK so dang sorry ugly blue 
HDouglas83,,[u'clutch_6'],I know this &amp; out there eating GO U OF L 
HDouglas83,,[u'CoreyPeters91'],kentucky who???? It has ALWAYS been about LOUISVILLE 
HDouglas83,,[],Here comes those cards I see ya 
HDouglas83,,[],UK fans better look at the history of teams stepping on our(Louisville) Cardinal birdHint hint 
HDouglas83,,[],We will also give away shoes &amp; gifts 
HDouglas83,,"[u'TDBFoundation', u'ATLmission']",Today continue Thanksgiving spirit providing meals for mothers &amp; children at My Sister's House from 330 to 6pm 
HDouglas83,,"[u'Oneway_Reedy', u'MartinoTheKid', u'HDouglas83']",RT Thanksgiving wit bra bra Freddie Fred HD 
HDouglas83,,[],HAPPY THANKSGIVING to all 
HDouglas83,Snapple,[u'Snapple'],my favorite snapple 
HDouglas83,,[],I love the DAWG in Steve SmithI just enjoy watching him play &amp; watching the passion he has for the game 
HDouglas83,,[],Blessed to wake up this morning GOD is goodGAME DAY &amp; back in da DOME 
HDouglas83,lohnjawrence,"[u'lohnjawrence', u'nflnetwork', u'roddywhiteTV', u'juliojones_11']",we gone keep it real 
HDouglas83,,[u'RushTravelLife'],Teaming up with HOME FOR THE HOLIDAYScontest Send a 1-page letter to info@rushtravellifestyle 
HDouglas83,LarrySlackjr,"[u'LarrySlackjr', u'HDouglas83']",you got a fan for life Thanks for making this day so special 
HDouglas83,,[],CONFIDENCE is CONTAGIOUS 
HDouglas83,,[],thank u for the support means a lot 
HDouglas83,,[u'TDBFoundation'],Great news opened up 300 more slots for the kids Go now &amp; register 
HDouglas83,ZachNagel7,[u'ZachNagel7'],all 
HDouglas83,AtlantaFalcans,[u'hitmarkered'],what u say 
HDouglas83,ZachNagel7,[u'ZachNagel7'],the guys I'm with now 
HDouglas83,,[u'Atlsportsnate'],lol I've been good how u &amp; the fam? 
HDouglas83,BecksSC5,"[u'BecksSC5', u'WillyMo_25']",ask 
HDouglas83,,[u'bree_lovess'],that's my brah we gone ride for one another no matter what Felt great 
HDouglas83,,[u'Atlsportsnate'],please stop it 
HDouglas83,Ariss8325,[u'Ariss8325'],we always put the work in so we knew it was in our hands to get 
HDouglas83,SIR_GI_OH,[u'SIR_GI_OH'],idk but I want a girl first 
HDouglas83,abrook728,[u'abrook728'],well I'm at the complex now Just finished working out &amp; watching filmSo football still 
HDouglas83,Black_Yankee,[u'Black_Yankee'],team sleeves this time 
HDouglas83,BOFAB311,[],all the WR's 
HDouglas83,irvinggon3,[u'irvinggon3'],when u teach me 
HDouglas83,dylan_wadzinski,[],Hal's steakhouse 
HDouglas83,Sam_Edwards1990,"[u'Sam_Edwards1990', u'Matt_Bryant3']",love him a lot Best clutch kicker of all time 
HDouglas83,durtyss96,[u'durtyss96'],we do our own thing 
HDouglas83,,[],after next year 
HDouglas83,Neva_fadedPO,[u'Neva_fadedPO'],my dad 
HDouglas83,SOGAchampions,[u'SOGAchampions'],when is it &amp; where? 
HDouglas83,NotFrenchATL,[u'NotFrenchATL'],it's is what it is 
HDouglas83,HoodlumBook,[u'zayo13'],haha it's tough 
HDouglas83,fiftytonhammer,[],big s/o to my falcons fans in Russia 
HDouglas83,hobbit2343,[u'hobbit2343'],Super Bowl ring 
HDouglas83,danilo_valverde,[u'danilo_valverde'],hello folks I definitely want to come visit 
HDouglas83,wildfan98,[u'wildfan98'],reading spending time wit fam dates with the wifey &amp; whatever is fun 
HDouglas83,jay_ballard,[u'jay_ballard'],nope not this time 
HDouglas83,judgecarothers,[u'judgecarothers'],duuuhhhhh 
HDouglas83,,[],thank u buddy for ur support how's ur say? 
HDouglas83,GK111123,[u'GregKidd1'],catching 
HDouglas83,dakidd717,[u'dakidd717'],catching a ball to help us get in FG range vs Seattle in playoffs 
HDouglas83,4SC0REand7,[],law school/lawyer 
HDouglas83,hobbit2343,[u'hobbit2343'],only focused on the Browns right now 
HDouglas83,tash_alot,"[u'tash_alot', u'SecretDeodorant']",secret &amp; anyone they have 
HDouglas83,APope45,[u'APope45'],staying committed the process 
HDouglas83,CurtisBloChi,[u'CurtisBloChi'],lol this guy here She's ALL mine lol 
HDouglas83,,[u'bryanice1'],looks or music? 
HDouglas83,RobertKQ,[u'RobertKQ'],whoever is great doesn't matter I love competition 
HDouglas83,KevKellum,[u'KevKellum'],the WR's group/coach &amp; Louisville fans 
HDouglas83,kissmebeautiful,[u'kissmebeautiful'],u have to make it online unfortunately get one &amp; thanks for the support 
HDouglas83,robert_h_wright,[u'robert_h_wright'],orange bowl victory 
HDouglas83,JediKnightSayNi,[u'JediKnightSayNi'],wheat bread ALL DAY 
HDouglas83,Gensicki37,[u'Gensicki37'],we are confident regardless 
HDouglas83,,[],mother &amp; wife also 
HDouglas83,,[],my father 
HDouglas83,corkyrobinson,"[u'corkyrobinson', u'SecretDeodorant']",SECRET it is sir 
HDouglas83,mattmooreSAV,[u'mattmooreSAV'],beating Seattle in playoffs 
HDouglas83,paul_fly,[u'paul_fly'],catch 100 footballs pray &amp; relax the mind 
HDouglas83,Wes_Morton,[u'Wes_Morton'],focused on being 1-0 each week finishing &amp; just knowing we have one another's back no matter what 
HDouglas83,,[],How's everyone today? I'm devoting my next 15 min to answering questions from fans Love the support we had Carolina 
HDouglas83,,[],Happy Bday to a GREAT friend Thanks for all the support &amp; ALWAYS believing in meI wish u the best day ever Bday girl 
HDouglas83,christuckerreal,[u'realctucker'],stay on board buddyWe grindin' 
HDouglas83,KDB_MLB,[u'KDB_MLB'],will do good to hear from you 
HDouglas83,KDB_MLB,[u'KDB_MLB'],thanks buddy how are you? 
HDouglas83,,[],Pre-game getting my routine 100 catches in &amp; kickin it with the ref 
HDouglas83,,"[u'JP_Agency', u'HDouglas83']",RT 
HDouglas83,,[],Never give up no matter whatGREAT TEAM WIN 
HDouglas83,,[],Falcons vs Panthers 1pm 
HDouglas83,,[],Blessed &amp; thankful GOD woke me this morningGAME DAY 
HDouglas83,,[u'AlexShipppp'],Make sure y'all check out in the new Aaliyah filmShe's on the come up 
HDouglas83,,[],Happy Bday to my mom A friend the most understanding person I know a CHRISTIAN exceptional mother &amp; motivator 
HDouglas83,austin_ballout5,[u'austin_ballout5'],congrats my brother 
HDouglas83,,[],I want to thank ALL the fans who came out &amp; supported tonight It's greatly appreciated &amp; GOD bless 
HDouglas83,,[],Always good to be back on the SOUTH-SIDE where I grew up 
HDouglas83,,[u'TailgateTeam'],I'll be at the Publix in Stockbridge tonight from 5-7PM with See you at 250 E Atlanta Rd 
HDouglas83,,[u'itsmieko'],Yall go to iTunes &amp; download my friend new hot single 
HDouglas83,,[],NEVER give up 
HDouglas83,,[],Feels good to land back in ATL with a GREAT TEAM WIN under our belts 
HDouglas83,FalcSteelMom,[u'FalcSteelMom'],love it 
HDouglas83,,[],Be a blessing to someone's lifeIt can be in anyway possible but give them a reason to smile &amp; have joy 
HDouglas83,,[],If GOD is on my side NO ONE can be against meAnything comes my way I'm taking it on with GOD 
HDouglas83,,[],Big Ben threw for 6 TD's again last night 
HDouglas83,,[u'Cirque'],Going to watch today here in Atlanta GABeen waiting to see them perform 
HDouglas83,,[],Who has on the best costume of the night????? 
HDouglas83,,[],Happy Halloween everyone make sure y'all be SAFE tonight 
HDouglas83,,[u'mcdonald'],What's you ask? I'm here to share the secret with all my fans Only available 
HDouglas83,,[],Louisville vs Florida State Thursday Night FootballHeading back to my college town to see the CARDS get a WIN 
HDouglas83,,[],Falcons vs Lions 930am EST on FOXLet's Get Get Get It 
HDouglas83,,[],Thank GOD for waking me up this morning 
HDouglas83,,[],Nothing like eating dinner in London with the people u love the most 
HDouglas83,,[u'mcdonald'],Your pre-game ritual just got a lot tastier Only available 
HDouglas83,,[],London bound 
HDouglas83,,[],Thank GOD for another day of breath 
HDouglas83,BrittonClark,"[u'BrittonClark', u'ATLmission', u'TDBFoundation', u'Delta']",yes sir he's a GREAT man 
HDouglas83,,"[u'IamZionDaFro', u'HDouglas83']",RT Salute to The Douglas Brothers Foundation for the great things they are doing with and the comm 
HDouglas83,,[],Remain confident no matter whatIf u put that work in there's NOTHING to FEAR or worry about anyway 
HDouglas83,,[],March of Dimes Bowling for Babies event last nightHad a great time 
HDouglas83,,"[u'ErikaBaranek', u'HDouglas83', u'ericweems']",RT and are spending time here at the Ronald McDonald House of Atlanta 
HDouglas83,,[],Thanks to all my teammates family March of Dimes staff sponsors everyone who donated &amp; came out 2night for the Bowling for Babies event 
HDouglas83,,[u'McDonaldsATL'],Call an audible Say restaurants and get your 10-pc game on 
HDouglas83,,[],March of Dimes Bowling event tonight 6pm Bowling for babies &amp; raising to help them be healthier &amp; have an efficient life 
HDouglas83,,[],GAMEDAY 
HDouglas83,,[u'ESPNNFL'],RT Stay focused Your start does not determine how you're going to finish Herm Edwards 
HDouglas83,,[u'mcdonald'],Getting ready for the big game? How's a $199 10-pc for your tailgate? Only available 
HDouglas83,,[u'UofLFootball'],S/o to for my gear 
HDouglas83,,[u'ESPNNFL'],RT Positive thinking is the key to success in business education and pro football anything you can mention in life Ron Jaw 
HDouglas83,,[],Thank GOD waking me up this morning 
HDouglas83,elisewryly,[u'elisewryly'],yea that's my fav Uncle &amp; one of the best a person can know Of course I'm nice 
HDouglas83,,[],Bowling for babies this Monday October 13th To donate &amp; sign up go to 
HDouglas83,td_mack,"[u'td_mack', u'HDouglas83']",Thanks I needed to hear this today Sometimes you need to hear words of encouragement 
HDouglas83,,[],Difficulty is meant to develop u Don't focus on hardship instead focus on how GOD is shaping u into a better u in the process Romans 53-4 
HDouglas83,,[u'NFLPA'],Help raise funds for cancer research by purchasing a Tshirt Campaign 
HDouglas83,,[],Just talked to my niece that's in Florida &amp; she just made my entire dayLove that girl sooooo much 
HDouglas83,,[],Stay COMMITTED to the process no matter whatBe faithful to it &amp; respect it 
HDouglas83,,[],I love the messages my mom send me EVERYDAYMOMS KNOW BEST was a message in church I heard about five(5) years ago 
HDouglas83,,[],Just finished eating Hooters on the south sideI remember my family friends being here with me the day I got drafted 
HDouglas83,,[],Sunday FootballSome good games coming on today 
HDouglas83,,[],Felt great to be in the end zone last nightI LOVE MY TEAM 
HDouglas83,,[u'D_Hest23'],Congrats to my brah for setting the record tonight with most returns for TD'smuch love brah 
HDouglas83,,[],Great team win tonight 
HDouglas83,,[],GAME DAY Falcons vs Bucs 830pm Thursday Night FootballLet's Get Get Get it 
HDouglas83,,[],Hope one of u wins 
HDouglas83,,[],It's a blessing to share a Bday with my better halfHappy Bday to my beauty queen &amp; myselfSeptember 16th babies 
HDouglas83,MacugaJr,[u'MacugaJr'],happy bday buddyVIRGO club have a blessed one 
HDouglas83,,[],I'm blessed &amp; thank GOD for waking me this morning 
HDouglas83,,[],Game Day Falcons vs Bengals 1pm on CBSLet's Get Get Get ItOnly da STRONG survives 
HDouglas83,,[],Up banging them weightsGood morning world 
HDouglas83,,[u'roddywhiteTV'],RT Btw Matt Bryant is a beast 
HDouglas83,annadamsholder,[u'annadamsholder'],thanks 
HDouglas83,,[],Stay COMMITTED to the process no matter what 
HDouglas83,,[u'M_Ryan02'],Congrats to for setting the TOUCHDOWN record today 
HDouglas83,,"[u'roddywhiteTV', u'D_Hest23', u'juliojones_11']",In case y'all forgot 
HDouglas83,,"[u'roddywhiteTV', u'D_Hest23', u'juliojones_11']",I heard on TV yesterday &amp; today people pick a secondary over our WR'sGuess that didn't go well &amp; 
HDouglas83,,[],Thank GOD for blessing me with life today 
HDouglas83,,[],GAME DAYNFL opener Falcons vs Saints 1pm on FOXLet's Get Get Get It 
HDouglas83,,[],This get your significant other 18 roses (for free) 
HDouglas83,,"[u'roddywhiteTV', u'juliojones_11', u'D_Hest23', u'ericweems']",I love the relationship between me &amp; All different personalities but BROTHERS 
HDouglas83,,[],Great job tonight by Louisville's Football TeamPlayed hard &amp; represented wellProud Alum &amp; ALWAYS will be 
HDouglas83,,[u'D_Hest23'],So should this be gear on Wednesday or my LOUISVILLE jersey???? Help me out AMERICA 
HDouglas83,Stevvw,[u'Stevvw'],oh ok yea we were REALLY good 
HDouglas83,Stevvw,[u'Stevvw'],u joking right??? 
HDouglas83,,[],not my problem but Miami's problem 
HDouglas83,,[],Great job DEFENSE 
HDouglas83,,[],TOUCHDOWN Louisville 
HDouglas83,,[u'clutch_6'],Da homie out there eatin 
HDouglas83,iHeartMiko,[u'iHeartMiko'],
HDouglas83,,[],BLACKOUT in LouisvilleBrings back GREAT memories 
HDouglas83,,[],BIG game tonight for Louisville CardinalsCards vs Canes 8pm on ESPN 
HDouglas83,CamSutton20,[u'CamSutton23'],I watched u last night lil homie &amp; I like what I seenKeep grindin &amp; stay committed to the process u have a bright future 
HDouglas83,,[u'NFLFilms'],RT Family dinner 
HDouglas83,ThisDaddys_Blog,"[u'ThisDaddys_Blog', u'HDouglas83']",Going bowling Should I bowl like YES YES YES YES 
HDouglas83,,[],Church was GREATAgreement is a protective shell around TWO that cannot be penetratedAgreement in a relationship is a POWERFUL thing 
HDouglas83,,[],BedtimeChurch in the morning goodnight world 
devontafreeman,,[],RT The will be taking over the NFL Draft combine Feb 17-23 
devontafreeman,,[],Good Morning Falcons 
devontafreeman,,[],Just got hooked up on Activate Excited to work with more businesses Check it out 
devontafreeman,,[],GOD TIMING IS PERFECT I LOVE THE PROCESS OF LIFE 
devontafreeman,,[],Searching for knowledge 
devontafreeman,,[],The way god work 
devontafreeman,,[],One day I hope to be one of the best ones 
devontafreeman,,[],Love Believe Trust Faith Dream GOD 
malliciahg,jacki_d,[u'jacki_d'],don't think u can go since you're an agent now 
malliciahg,,[u'katyperry'],RT Today is for this girl She had the dream always believed in herself &amp; her worth Today she is the one smiling 
malliciahg,OHYEAH_BIG12,[u'OHYEAH_BIG12'],I got it 
malliciahg,OHYEAH_BIG12,[u'OHYEAH_BIG12'],same cell? 
malliciahg,OHYEAH_BIG12,[u'OHYEAH_BIG12'],ATL Be in Nashville for Business Friday and then comin 
malliciahg,OHYEAH_BIG12,[u'OHYEAH_BIG12'],Gatlinburg? 
malliciahg,AJPineau,[u'AJPineau'],you're forever gettin hurt 
malliciahg,,[],indeed 
malliciahg,,"[u'AttorneyCrump', u'IAmSteveHarvey']",RT Join me in wishing my fraternity brother and friend a Happy Birthday 
malliciahg,,[u'FalconsRMcKay'],RT Great piece on a really quality personStuart Scott was a class act and a true professional 
malliciahg,,[u'ClemsonTigers'],RT wins and senior QB Cole Stoudt is your MVP Go Tigers 
malliciahg,,[],Merry Christmas 
malliciahg,,[],Landed safely in New Orleans Ready for this big division game tomorrow 
malliciahg,,[u'MinisterTrapp'],RT N Christ you are already blessed with every spiritual blessing in the heavenly places Eph 13 
malliciahg,,[],Prayers out to the Ohio State program and the family of Kosta Karageorge Sad story to hear 
malliciahg,,[],as long as they work I'm all for it 
malliciahg,,"[u'jchat3', u'MALG93']",RT so cool getting one of your signed ornaments in the mail today great cause Happy holidays MG 
malliciahg,,[],Dang that's what I call a BURNT chicken Lol 
malliciahg,,[],Happy Thanksgiving to everyone God bless 
malliciahg,krisbessette,[u'krisbessette'],happy thanksgiving to you also 
malliciahg,,[u'Stuntman1429'],Praying for and the rest of the Berry family Keep stayin positive and movin forward through this bump in the road God bless 
malliciahg,,"[u'aThreeAthletics', u'a3Chad']",RT Our prayers are with Eric and the entire Berry family Statement from Chad Speck Eric's agent 
malliciahg,,[u'ClemsonBuzzz'],RT RT Every SUNDAY we ask that Family RT to show we still support &amp; care for those who serve 
malliciahg,,[],RT 
