screen_name,in_reply_to_screen_name,mentions,full_text
VicBeasley3,BasedxWorld,"[u'BasedxWorld', u'Marcstein0', u'AverageJowe']",I may be a little busy this weekend 
VicBeasley3,Marcstein0,[u'Marcstein0'],Thanks Marc 
VicBeasley3,rogersherrer,[u'rogersherrer'],That's what's up Thank you for your support Also thanks for serving and protecting 
VicBeasley3,morganmason100,[u'morganmason100'],You know it Mason 
VicBeasley3,ZachNagel7,[u'ZachNagel7'],
VicBeasley3,Vansavage_chris,[u'Vansavage_chris'],You know it You guys do such a good job of showing me love all the time 
VicBeasley3,SweetGASports,[u'SweetGASports'],love y'all 
VicBeasley3,FalconsFlockin,"[u'FalconsFlockin', u'nickleboeuf5']",
VicBeasley3,RyanFrazier_,[u'RyanFrazier_'],Thank you Ryan 
VicBeasley3,JulioInTheCut,[u'JulioInTheCut'],Big mistake sad 
VicBeasley3,Coreyshores,[u'Coreyshores'],Thank you Corey 
VicBeasley3,Marcstein0,[u'Marcstein0'],my phone would never stop blowing up 
VicBeasley3,B_Rath40,[u'B_Rath40'],Well that's never going to happen so 
VicBeasley3,C_cat34,"[u'C_cat34', u'bradeyp28', u'jbbigbear']",Bosa is a beast 
VicBeasley3,BonelessPizza04,[],Thanks bro 
VicBeasley3,mcbride_tommy,[u'mcbride_tommy'],no thanks I don't play on the PS3 anymore 
VicBeasley3,rhopkins_,[u'rhopkins_'],SAME HERE 
VicBeasley3,MHolwackers,[u'MHolwackers'],Yes no maybe 
VicBeasley3,triciahanson,"[u'triciahanson', u'ClemsonUniv']",I wouldn't be the man I am today if it weren't for 
VicBeasley3,GWright02,[u'GWright02'],that's why you're the man Garrett 
VicBeasley3,,[],Send me a video 
VicBeasley3,hearmeent,[u'hearmeent'],Yes sir 
VicBeasley3,HarryCFC_,[u'HarryCFC_'],I'll think about it 
VicBeasley3,Sammy_Asad,[u'Sammy_Asad'],You know it bro 
VicBeasley3,farheezy11,[u'farheezy11'],Thanks for the support bro 
VicBeasley3,mtparan,[u'mtparan'],Yes 
VicBeasley3,hearmeent,"[u'hearmeent', u'JColeNC']",Things like that happen We're going to bounce back 
VicBeasley3,AllenGettinDoug,[u'AllenGettinDoug'],
VicBeasley3,SajinThao,[u'SajinThao'],Well thank you Glad to finally meet my biggest fan 
VicBeasley3,collincowart,[u'collincowart'],thks dad 
VicBeasley3,XThunder21,[],Thank you so much 
VicBeasley3,Kor5bin,[u'Kor5bin'],I hope you two have a great time 
VicBeasley3,beth_lee,"[u'beth_lee', u'FourVerts']",can we drop the hottest mixtape of the winter?? 
VicBeasley3,patrickbond11,[u'patrickbond11'],I don't hate it lol 
VicBeasley3,,"[u'patrickbond11', u'VicBeasley3']",RT Can I get a RT from the best pass rusher in the NFL 
VicBeasley3,marygodley,"[u'marygodley', u'williamgchilds']",Look who isn't private anymore 
VicBeasley3,DepressedChann,[],You didn't miss out 
VicBeasley3,,[u'VicBeasley3'],RT Don't tell me I missed a chance for my tweet to get retweeted by the one and only 
VicBeasley3,UnholyJane420,[u'UnholyJane420'],can't think that much in the moment Just have to react 
VicBeasley3,j_vick86,[u'j_vick86'],For sure 
VicBeasley3,SSgtDevor,[u'SSgtDevor'],Thank you for your service It was a great experience meeting you guys this summer 
VicBeasley3,,"[u'SSgtDevor', u'VicBeasley3']",RT one of our favorite pics how bout a RT 
VicBeasley3,cleo__chang,[],Send me the results 
VicBeasley3,briangrunt311,[u'briangrunt311'],Grady is one of my best friends It amazing to have the chance to play with him 
VicBeasley3,BerhaneHanock,[u'BerhaneHanock'],Hit up Chuck Smith 
VicBeasley3,BrianVislusky,[u'BrianVislusky'],That's what I keep hearing They'll get it right 
VicBeasley3,bozie85,[u'bozie85'],Yes sir where are you from? 
VicBeasley3,tPortillo_,[u'tPortillo_'],
VicBeasley3,BrandonWhitley7,[u'BrandonWhitley7'],You got it 
VicBeasley3,Trickman44,[u'Trickman44'],Thanks coach 
VicBeasley3,williamgchilds,"[u'williamgchilds', u'marygodley']",those are great 
VicBeasley3,KingAustinW,[u'KingAustinW'],Just doing what I can 
VicBeasley3,mcbride_tommy,"[u'mcbride_tommy', u'Galgano_31']",Please 
VicBeasley3,falconsfan29,[u'falconsfan29'],Glad I could do something to make your day a little better Thanks for the support 
VicBeasley3,,"[u'tigeramy75', u'RiseUpRyanKC', u'VicBeasley3']",RT our house too 
VicBeasley3,SheScream_Nkosi,[u'SheScream_Nkosi'],Not finished yet 
VicBeasley3,collincowart,[u'collincowart'],
VicBeasley3,collincowart,[u'collincowart'],Proud to follow you Collin 
VicBeasley3,requestGranted,[u'requestGranted'],You already know 
VicBeasley3,rherbert28,[u'RHerbert7'],You know Victor is a pretty good name for a boy 
VicBeasley3,Alex17284,[],Thanks bro 
VicBeasley3,,"[u'bradylynch1', u'VicBeasley3']",RT Hey I'm a very big Falcons fan and ur one of my favorite players A RT would be nice-) 
VicBeasley3,officialDIN,[u'officialDIN'],Thank you I really appreciate it 
VicBeasley3,therealATLfan,[u'therealATLfan'],Me too 
VicBeasley3,,[],
VicBeasley3,nickleboeuf5,[u'nickleboeuf5'],When and where? 
VicBeasley3,,"[u'nickleboeuf5', u'VicBeasley3']",RT i will let you sack me for a retweet 
VicBeasley3,thierno_45,[u'thierno_45'],Thank you 
VicBeasley3,Slayde_31,[u'Slayde_31'],I love it Thank you 
VicBeasley3,williamgchilds,[u'williamgchilds'],just seeing this tweet Trying to get through them all 
VicBeasley3,PrettyRachael_,[u'PrettyRachael_'],Glad I could help Thank you 
VicBeasley3,fortner74,[u'fortner74'],Thank you both 
VicBeasley3,Aaron_Elb14,[u'Aaron_Elb14'],just depends on how he feels If he's good to go he's good to go 
VicBeasley3,Mme_Falcon,[u'Mme_Falcon'],It's always a good time for me too It's really hard to get to everyone quickly though 
VicBeasley3,tsapp20,[u'tsapp20'],Yes I need to get on that 
VicBeasley3,DeadlyLanzini,[u'DeadlyLanzini'],My first sack was awesome BUT that strip sack that ended the Panthers perfect season was special 
VicBeasley3,,"[u'Galgano_31', u'VicBeasley3']",RT I am your biggest fan from Chi Town can I get a retweet? 
VicBeasley3,JoseGatsby,[u'JoseGatsby'],good picture You had awesome seats 
VicBeasley3,j_vick86,[u'j_vick86'],Yes sir 
VicBeasley3,Kevvnorris,[u'Kevvnorris'],Sounds like a dream come true 
VicBeasley3,,[],Good luck with your finals I won't accept anything less than all A's 
VicBeasley3,Zachary_Troy,[u'Zachary_Troy'],I never thought I'd have animals named after me Crazy Thanks for the love and support 
VicBeasley3,,"[u'Zachary_Troy', u'VicBeasley3']",RT how can someone with a cat named after you not get a shoutout AND a follow? 
VicBeasley3,KCartledge85,[u'KCartledge85'],I do a little bit of both really 
VicBeasley3,Galgano_31,[u'Galgano_31'],Clemson and Atlanta 
VicBeasley3,slip1818,[u'slip1818'],I agree 
VicBeasley3,harryjimjim,"[u'harryjimjim', u'JSHarry10']",happy to do it 
VicBeasley3,,"[u'BerhaneHanock', u'VicBeasley3']",RT lemme get a retweet too 
VicBeasley3,tommyulmer,[u'tommyulmer'],Thank you Tommy 
VicBeasley3,Travis_Mccaslin,[u'Travis_Mccaslin'],
VicBeasley3,GoFalcons13,[u'GoFalcons13'],Still a ton of work to do Thank you 
VicBeasley3,Money_Launderer,[u'Money_Launderer'],You already know 
VicBeasley3,RiseUpRyanKC,[u'RiseUpRyanKC'],and I love y'all Thanks for all your support Ryan 
VicBeasley3,,"[u'RiseUpRyanKC', u'VicBeasley3']",RT we love in this house 
VicBeasley3,BeardMobInc,[u'craig_kelley'],now there's an idea The problem with forcing so many fumbles is that you rarely have a chance to pick it up 
VicBeasley3,williamgchilds,"[u'williamgchilds', u'marygodley']",is this true 
VicBeasley3,,"[u'williamgchilds', u'VicBeasley3', u'marygodley']",RT Hey One of my good friends has a huge crush on you AND she's Clemson alum too How about a RT 
VicBeasley3,,[],I'm blessed to be here I love you guys 
VicBeasley3,Galgano_31,[u'Galgano_31'],only way to do it 
VicBeasley3,thenamesJSwag,[u'thenamesJSwag'],Doing what I can Thanks Justin 
VicBeasley3,Mercury_nM,[u'Mercury_nM'],Yo Thank you 
VicBeasley3,,[],Thank you 
VicBeasley3,Fadytweettweet,[u'Fadytweettweet'],Thank you I'm blessed to be here It's the least I can do 
VicBeasley3,Crawziggy,[u'Crawziggy'],you know I do 
VicBeasley3,,[],what are you going to give me for one? 
VicBeasley3,chm202,[u'chm202'],that is a great picture 
VicBeasley3,,"[u'chm202', u'VicBeasley3']",RT Proud for you sir Miss our piano man in that orange tho 
VicBeasley3,ATLSportsProfit,[u'EAMaddenNFL'],They're going to get it right Just a little extra motivation 
VicBeasley3,Jharris_CFC,[u'Jharris_CFC'],They're great I'll probably get them back out after the season is over 
VicBeasley3,W4RSAME,[],I better get to work 
VicBeasley3,duncanbarchard,[u'duncanbarchard'],Nah you guys are I'm truly blessed 
VicBeasley3,JHobart1,[u'JHobart1'],Have a good time I love that jersey 
VicBeasley3,amymiles1966,[u'amymiles1966'],Thanks Amy 
VicBeasley3,KCartledge85,[u'KCartledge85'],really depends on who you ask 
VicBeasley3,FreeBandGang_9,[u'FreeBandGang_9'],You know what I'm going to try and do that just for you 
VicBeasley3,cbradshaw9teen,[u'cbradshaw9teen'],Thank you Cole 
VicBeasley3,Its_Tahmal,"[u'Its_Tahmal', u'EAMaddenNFL']",
VicBeasley3,DelaurierJames,[u'DelaurierJames'],Thanks James 
VicBeasley3,FalcoholicMatt,"[u'FalcoholicMatt', u'FourVerts']",Shots fired 
VicBeasley3,,"[u'north0813', u'VicBeasley3']",RT the last tweet wouldn't work but I'd love to get a RT Keep it up man 
VicBeasley3,ashymptote,[u'ashymptote'],Thank you for your love and support Ashley I really appreciate it 
VicBeasley3,amciver2010,[u'amciver2010'],just trying to get better 
VicBeasley3,atlJE,[u'atlJE'],Thanks bro 
VicBeasley3,kevnolan,[u'kevnolan'],Little things here and there The best way to keep up is checking here I'll tweet or Instagram anything I do 
VicBeasley3,,[],Nah still going strong Trying to get to everyone 
VicBeasley3,FourVerts,[u'FourVerts'],What are you writing about? 
VicBeasley3,EliDills10,[u'EliDills10'],I wanted to be a Falcon for sure 
VicBeasley3,slip1818,[u'slip1818'],Thank you William 
VicBeasley3,lanis_81,[u'lanis_81'],Thanks Zak 
VicBeasley3,Ben_Worthan,[],thanks 
VicBeasley3,,"[u'peterhess99', u'VicBeasley3']",RT big fan man Can I get a retweet? 
VicBeasley3,KCartledge85,[u'KCartledge85'],I think they're working on it 
VicBeasley3,SFF_nosaM,[u'CptKnucklez'],
VicBeasley3,TylerJBaez14,[u'TylerJBaez14'],Always the plan 
VicBeasley3,FourVerts,[u'FourVerts'],
VicBeasley3,,[],Of course You're either getting better or you're getting worse There's no in between 
VicBeasley3,,[],Always have to keep your head up and push through Life isn't always supposed to be easy I'm blessed to be here 
VicBeasley3,yungmasedgod,[],For sure 
VicBeasley3,blakethegreat24,[u'blakethegreat24'],Thank you for that 
VicBeasley3,BradleyFurr,[u'BradleyFurr'],Thanks for the support 
VicBeasley3,EliDills10,[u'EliDills10'],I like it 
VicBeasley3,Averywilson56,[u'Averywilson56'],too many 
VicBeasley3,yungmasedgod,[],I love all of y'all Thanks for the support 
VicBeasley3,chasemac211,[u'chasemac211'],Y'all are building something though Give that D just a little more time 
VicBeasley3,atl_babu,[u'atl_babu'],Thank you 
VicBeasley3,Fadytweettweet,[u'Fadytweettweet'],not sure right now 
VicBeasley3,cole_cham,[u'cole_cham'],For sure 
VicBeasley3,north0813,[u'north0813'],Tried to RT but it wouldn't Thanks for the love and support 
VicBeasley3,ATLBlueJay,[u'ATLBlueJay'],I can't either 
VicBeasley3,,[],Julio is one of the toughest guys I know It's going to take a lot to stop Jet Jones 
VicBeasley3,,[u'VicBeasley3'],RT Can I have a retweet too lol? 
VicBeasley3,mattharrelson16,[u'mattharrelson16'],Hope you get that new tv 
VicBeasley3,msjacob255,[u'msjacob255'],
VicBeasley3,chasemac211,[u'chasemac211'],Dante Fowler is going to be a great player You have to give guys more than 12 games 
VicBeasley3,az241,[u'az241'],I think I remember you Have you tweeted me about that before? 
VicBeasley3,,"[u'tigeramy75', u'VicBeasley3']",RT while you're retweetingNational Champ game in Jan 
VicBeasley3,tigeramy75,[u'tigeramy75'],Hopefully it goes the other way this year 
VicBeasley3,DOP3Sweet,[u'DOP3Sweet'],
VicBeasley3,,"[u'DOP3Sweet', u'VicBeasley3']",RT since you're retweeting folks right now hey boo 
VicBeasley3,,"[u'5Rudy4', u'VicBeasley3']",RT can I get a retweet too? ordered your jersey and it gets here friday 
VicBeasley3,FalconsBirdLady,[u'FalconsBirdLady'],you should have just cut him out 
VicBeasley3,,"[u'thezachstud', u'VicBeasley3']",RT Call me 
VicBeasley3,thezachstud,[u'thezachstud'],Signature move 
VicBeasley3,,"[u'prettylalabella', u'VicBeasley3', u'719_678']",RT we love you beasley jr 
VicBeasley3,FabGab93,[u'FabGab93'],For sure Good luck 
VicBeasley3,,"[u'FabGab93', u'VicBeasley3']",RT By the way Can I get a retweet from one of my favorite Falcons It's Finals Week and I need some encouragement 
VicBeasley3,KohZayTapes,[],thanks for the support and god bless you 
VicBeasley3,peterhess99,[u'peterhess99'],Still gotta get my numbers up 
VicBeasley3,KohZayTapes,[],Thats what up Happy early birthday Black is probably my favorite or the red Can't go wrong really 
VicBeasley3,KohZayTapes,[],Just doing my part bro 
VicBeasley3,SnickerMica,[],Happy Birthday 
VicBeasley3,curry_antwan,[u'curry_antwan'],Thanks bro 
VicBeasley3,,[],Only way to be 
VicBeasley3,chucksmithnfl,[u'chucksmithnfl'],Thanks Chuck 
VicBeasley3,,"[u'chucksmithnfl', u'AtlantaFalcons', u'VicBeasley3']",RT Welcome to the Double Dgit Sack Family Keep it Up 
VicBeasley3,dockrys329,[u'dockrys329'],Remember when they gave Devin Hester 100 Speed? I'm trying to get like that 
VicBeasley3,dockrys329,[u'dockrys329'],Tell me about it 
VicBeasley3,Jake_StL44,"[u'Jake_StL44', u'EAMaddenNFL', u'NFL']",
VicBeasley3,praying4carolyn,"[u'praying4carolyn', u'VivaAtl', u'coach_jeffscott']",No I am thankful that there are great people in this world like you 
VicBeasley3,,"[u'VivaAtl', u'coach_jeffscott', u'VicBeasley3']",RT And w/ every sack he &amp; fans help fight childhood cancer is a leader on &amp; off field 
VicBeasley3,prettylalabella,[u'prettylalabella'],Thank you for your support 
VicBeasley3,HighEndFly,[u'HighEndFly'],You already know 
VicBeasley3,,[],S/O to Jamarcus Chatman and The Rome Wolves on making it to the State Championship 
VicBeasley3,stewartdantec,[u'stewartdantec'],haha bro we could never beat that one level 
VicBeasley3,,"[u'RallyFoundation', u'VicBeasley3']",RT MT and big thanks to for joining our Rally Kids in their fight against childhood cancer https/ 
VicBeasley3,,[],Sad to hear Joe McKnight has passedRIP Joe many memories you left us with My prayers are with the family 
VicBeasley3,SwiftHitter,[u'SwiftHitter'],how'd he do? 
VicBeasley3,PFF,[u'PFF'],Good looking out 
VicBeasley3,,[u'AJaClay'],RT Surgery went great Time to attack this recovery so I can get back out there with my brothers 
VicBeasley3,,[],
VicBeasley3,,[],Help the man out 
VicBeasley3,cuntrybumpkin26,[u'cuntrybumpkin26'],hopefully I can get one for you lol 
VicBeasley3,DirtyBirdStomp,[u'DirtyBirdStomp'],
VicBeasley3,AlgerRyan,[u'AlgerRyan'],glad you fixed that lol 
VicBeasley3,cuntrybumpkin26,[u'cuntrybumpkin26'],Happy Birthday Bre 
VicBeasley3,,"[u'RiseUpRyanKC', u'AtlantaFalcons', u'VicBeasley3', u'Mo_12_Sanu', u'devontafreeman', u'Keanu_Neal', u'DesmondTrufant', u'M_Ryan02']",RT Thankful for my squad 
VicBeasley3,EvanBirchfield,[u'EvanBirchfield'],I'm hoping to be busy that week but thank you for the offer 
VicBeasley3,,"[u'AtlantaFalcons', u'NFL']",
VicBeasley3,,[],My heart is heavy rn It hurts to see youth (period) lose their life and even more in the situation they lost it in 
VicBeasley3,,[],was amazingone of the best finals I've ever seen 
VicBeasley3,,[u'normparkerhoops'],RT 10 year old Kristian Lando diagnosed with LeukemiaSTARS Family &amp; Vic Beasley Jr praying for this young fellow 
VicBeasley3,,[u'clemsonwsoccer'],RT Clemson Headed to Sweet 16 after Downing Arkansas in Penalty Kicks READ 
VicBeasley3,,[],LET'S GO CU 
VicBeasley3,ez4shrt,[],That's what's up thank you 
VicBeasley3,,"[u'RallyFoundation', u'VicBeasley3']",RT Way to Thank you for supporting Rally with the Beasley 44 Challange 
VicBeasley3,,"[u'AtlantaFalcons', u'VicBeasley3']",RT 95 sacks through the first 10 games for A no-brainer for the Pro Bowl RT to send him to Orlando 
VicBeasley3,,"[u'juliojones_11', u'VicBeasley3', u'DesmondTrufant', u'M_Ryan02']",RT 
VicBeasley3,,"[u'theMMQB', u'JennyVrentas', u'AtlantaFalcons', u'VicBeasley3']",RT on the young defense We are so close to being a great defense says 
VicBeasley3,nerlens_,[u'nerlens_'],
VicBeasley3,nerlens_,[u'nerlens_'],What do I get WHEN I win? 
VicBeasley3,,[u'LoudMouthGuards'],S/O to for the hookup 
VicBeasley3,,[],Tasha Cobbs Concert 
VicBeasley3,FarBeyondNick,[u'FarBeyondNick'],Happy Birthday 
VicBeasley3,,[],It's Gameday 
VicBeasley3,,[],We have ourselves a game people 
VicBeasley3,MsCharity429,[u'MsCharity429'],hmm I may have to do that 
VicBeasley3,carvotta_wendy,[u'carvotta_wendy'],Thank you for all your love and support It means a lot to me 
VicBeasley3,,[],There's still plenty of time to donate For the two of you that have already send me proof I have a gift for you 
VicBeasley3,,[],For those of y'all that don't know Brian gives something away every single week Give him a follow so you don't miss out 
VicBeasley3,jdlemon95,[u'jdlemon95'],that's the goal 
VicBeasley3,,[],It's such a blessing Really and truly everyone on this team is like a brother to me I couldn't have asked for a better situation 
VicBeasley3,,[],Don't forget 
VicBeasley3,UpsguyatlParker,[u'UpsguyatlParker'],Yes sir 
VicBeasley3,HarbaughtheGOAT,[u'HarbaughtheGOAT'],Anyone that knows me knows that I don't hate anyone 
VicBeasley3,ericparker0274,[u'ericparker0274'],You're crazy 
VicBeasley3,used2liveonmars,"[u'used2liveonmars', u'AtlantaFalcons']",That's me to you my man thank you for your service 
VicBeasley3,CarasikS,[u'CarasikS'],
VicBeasley3,,[],
VicBeasley3,dawgtag77,[u'dawgtag77'],Thank you so much 
VicBeasley3,,[u'kristen_laurren'],is this you? lol thanks for the support 
VicBeasley3,HarbaughtheGOAT,"[u'HarbaughtheGOAT', u'jonescarson1', u'mainey_maine']",Make up your mind 
VicBeasley3,,[],Join me in helping to support the people of Haiti and RT this tweet for a chance to win an autographed picture 
VicBeasley3,Everett_G_0724,[],Thanks for all your love and support 
VicBeasley3,,[u'GradyJarrett'],Yep props to on that one 
VicBeasley3,russ_head,[u'russ_head'],Thank you so much for that 
VicBeasley3,,"[u'LauraOkmin', u'AtlantaFalcons']",RT Mindset of the entire TEAM Word I heard most on all sides of ball BROTHERHOOD They're not saying it the 
VicBeasley3,kingfred91,[u'kingfred91'],Thanks Fred 
VicBeasley3,LucasOlsen,[u'LucasOlsen'],You should have checked my mentions a month ago 
VicBeasley3,_fortheloveofAj,[u'_fortheloveofAj'],Oh no doubt and I really appreciate all the love I'm beyond blessed 
VicBeasley3,Orengerman,"[u'Orengerman', u'_fortheloveofAj']",Thank you and I appreciate it 
VicBeasley3,VicBeasley3,[u'_fortheloveofAj'],but thank you and God bless you 
VicBeasley3,,[],Individual stats look great on the back of a football card but the only numbers that matter to me right now are wins and losses 
VicBeasley3,HibbettSports,"[u'HibbettSports', u'PartyStarcher']",That's right next to my home town you can't tell me they wouldn't sell lol good looking out Casey 
VicBeasley3,J_Price86,[u'J_Price86'],Well I apologize man I can assure you it wasn't anything personal 
VicBeasley3,J_Price86,[u'J_Price86'],What are you talking about? 
VicBeasley3,,[],GameDay 
VicBeasley3,,[],Love being home 
VicBeasley3,,[],
VicBeasley3,,[u'DerrickShelbyII'],RT Out of surgery all is well Thanx for all the warms wishes 
VicBeasley3,,"[u'ericparker0274', u'AtlantaFalcons', u'FalconsDQ', u'VicBeasley3']",RT &amp; 
VicBeasley3,,"[u'AFTicketOffice', u'VicBeasley3']",RT Looking for an autographed mini-helmet? RT for your chance to win Winner will be announced tomorrow at 10 
VicBeasley3,,[],RIP Tommy Fordyou played an awesome role in my favorite show Your legacy lives on 
VicBeasley3,J_Michael315,[u'J_Michael315'],can't let Twitter get to you Thanks for the support 
VicBeasley3,,[],I appreciate all the love and support I've gotten over the last 24 hours You guys are amazing It's on to Seattle now 
VicBeasley3,OhioUpdates10,[u'AEargle'],Good looking stuff 
VicBeasley3,CoachHessler,[],You made that? 
VicBeasley3,RiseUpRyanKC,"[u'RiseUpRyanKC', u'AtlantaFalcons']",Thank you so much for that Things like this really make my day 
VicBeasley3,,"[u'RiseUpRyanKC', u'VicBeasley3', u'AtlantaFalcons']",RT someone wanted to congratulate you on your great game today 
VicBeasley3,kdodd98,[u'kdodd98'],Thanks bro You're next 
VicBeasley3,,[],Role models set goals for you and try to make you as good as they are 
VicBeasley3,,[],But as for you be strong and do not give up for your work will be rewarded 2 Chronicles 157 
VicBeasley3,,[u'FreakMagic2'],RT Thanking GOD for allowing me see to see another day &amp; 
VicBeasley3,,"[u'chrisrandall44', u'VicBeasley3', u'ryanrandall_9']",RT SPECIAL PERSON AND PLAYER RiseUp with and Reed Randall 
VicBeasley3,,[u'ryancameron'],RT Go get em VB We don't care if it's paper or plastic get us sacks 
VicBeasley3,,[],
VicBeasley3,Nicole_Carter4,[u'Nicole_Carter4'],well I'm cheering for her 
VicBeasley3,,"[u'Nicole_Carter4', u'VicBeasley3', u'RallyFoundation']",RT Rally Kid Mary Tipton cheering for you today 
VicBeasley3,,[],Great TEAM win 
VicBeasley3,jgo2409,[u'jgo2409'],I hope so Lamar Jackson is going to be tough to stop but I think we can do it 
VicBeasley3,HarryCFC_,[u'HarryCFC_'],Hi 
VicBeasley3,,[],Hope everyone is having a wonderful 
VicBeasley3,gcdonalds,"[u'AtlantaFalcons', u'Teco_Raww', u'McDonaldsATL']",THE WORLD NEEDS TO KNOW 
VicBeasley3,AtlantaFalcons,"[u'AtlantaFalcons', u'Teco_Raww', u'McDonaldsATL']",Are you going to eat the rest of those fries? 
VicBeasley3,iamtonyprice,[u'iamtonyprice'],All day 
VicBeasley3,,"[u'FalconsATLCW', u'VicBeasley3', u'RallyFoundation']",RT September is &amp; is making every tackle count for 
VicBeasley3,,"[u'Jrod629', u'VicBeasley3']",RT Kick in the door wavin' the 44 
VicBeasley3,ThatGuyPujo,[u'ThatGuyPujo'],Happy Birthday 
VicBeasley3,Nicole_Carter4,[u'Nicole_Carter4'],THATS AMAZING So happy for her 
VicBeasley3,,"[u'Nicole_Carter4', u'VicBeasley3']",RT Guess who had clear scans? Rally Kid Mary Tipton is 16 months cancer free 
VicBeasley3,,[],R O M A N S 8 13 
VicBeasley3,,[u'MikeVick'],RT Lamar Jackson 5x better than what I was at V-TechEnough said 
VicBeasley3,,[u'VicBeasley3'],RT can a Falcons fan get a rt 
VicBeasley3,,"[u'ericparker0274', u'AtlantaFalcons', u'FalconsDQ', u'VicBeasley3']",RT let's go get them Raiders https 
VicBeasley3,,[u'VicBeasley3'],RT Thank you for taking the time in Orlando to talk and take a picture with me 
VicBeasley3,,"[u'logawa65', u'AtlantaFalcons', u'VicBeasley3']",RT We everyday 
VicBeasley3,,[u'HangNwitCoop'],RT 
VicBeasley3,,[],
VicBeasley3,JustinLogan88,[],
VicBeasley3,,"[u'SZon2', u'VicBeasley3']",RT Help tackle childhood cancer w/ 'Vic Beasley Tackle Sack Challenge' DETAILS 
VicBeasley3,chasegonzo6,[u'chasegonzo6'],Haha You found me 
VicBeasley3,MsDGamble,[],Happy birthday Hope it's great 
VicBeasley3,,[],Today we honor our heroes our first responders and all of those that were lost that day 
VicBeasley3,AntLombardi,[u'AntLombardi'],Thank you both 
VicBeasley3,,"[u'AntLombardi', u'VicBeasley3']",RT maybe a future or You're his fave player Good luck this year 
VicBeasley3,Ashley_nyg_8,[],Thank you 
VicBeasley3,,"[u'ericparker0274', u'AtlantaFalcons', u'FalconsDQ', u'VicBeasley3', u'M_Ryan02']",RT htt 
VicBeasley3,,"[u'RiseUpRyanKC', u'AtlantaFalcons', u'VicBeasley3', u'devontafreeman', u'Mo_12_Sanu']",RT I live that Falcon life 
VicBeasley3,,"[u'Isolis90', u'AtlantaFalcons', u'VicBeasley3', u'FalconsDQ']",RT 
VicBeasley3,,"[u'AustinCBoyd', u'AtlantaFalcons', u'FalconsDQ', u'VicBeasley3']",RT Full Falcons fit from head to toe Did I do right? https/ 
VicBeasley3,,"[u'RallyFoundation', u'VicBeasley3', u'TBbuccaneers']",RT Have You Taken the Challenge? First regular season home game is Sunday at 1 pm v the ht 
VicBeasley3,,[u'FalconsDQ'],RT Make sure to rep your birds tomorrow We cant wait to play in front of the best fans in the NFL this Sunday 
VicBeasley3,,[],
VicBeasley3,,"[u'BrittonClark', u'devontafreeman', u'VicBeasley3', u'ATLmission']",RT So proud of &amp; for helping the kids go Back to School shopping That new backpack 
VicBeasley3,,"[u'FalconsCR', u'devontafreeman', u'VicBeasley3', u'ATLmission']",RT Tonight &amp; sponsored a back to school shopping spree with the kids of 
VicBeasley3,,[u'FalconsMHaley'],RT Looks like lost a bet to &amp; 
VicBeasley3,,[],What a game 
VicBeasley3,iWalkDifferent,[],They start hitting every time I stop streaming 
VicBeasley3,,[],LIVE on Vic Beasley Jr's 2nd annual 5 on 5 tournament 
VicBeasley3,,[],LIVE on It's still early Plenty of time to make it out 
VicBeasley3,,[],LIVE on Vic Beasley Jr's 2nd Annual Basketball Tournament 
VicBeasley3,,"[u'mikelinch', u'JacobTamme', u'LevineToilolo', u'PatDiMarco42', u'VicBeasley3']",RT So good to see this morning at chapel Incredible men 
VicBeasley3,NavyLaxLife,[u'NavyLaxLife'],and I feed off of that I need that You guys are why I do it 
VicBeasley3,RiseUpReader,[u'RiseUpReader'],yes I'm excited Ready to get to work 
VicBeasley3,NavyLaxLife,[u'NavyLaxLife'],Not yet But I'm working to get there 
VicBeasley3,,[],Yes 
VicBeasley3,,[u'LILCOREY_TRILL'],RT Thank God Daily 
VicBeasley3,ClutchKYD,"[u'ClutchKYD', u'AtlantaFalcons']",That's the goal 
VicBeasley3,HCFrost01,[u'HCFrost01'],I'm ready for it 
VicBeasley3,tyler1stt,"[u'tyler1stt', u'AtlantaFalcons']",Yes sir 
VicBeasley3,MacButts,[u'MacButts'],Thank you Me too 
VicBeasley3,Medina15Roman,[u'Medina15Roman'],Thank you 
VicBeasley3,,[],
VicBeasley3,kingfred91,[u'kingfred91'],it's all part of it man 
chesterchris66,,[u'Deadspin'],RT Cool charts show you just how good the NBA has gotten 
chesterchris66,,"[u'williamdrew57', u'HypeKillsNYC', u'kickstarter', u'chesterchris66', u'AlexCorbs']",RT I just 2017 collection on 
chesterchris66,,"[u'Tyler_Polumbus', u'chesterchris66']",RT Cakes and Pies cakes and pies 
