screen_name,in_reply_to_screen_name,mentions,full_text
rockorocky,KennyMCreative,"[u'KennyMCreative', u'rockorocky']",Here's a print I've been working on 13x19 gonna look awesome 
rockorocky,,[],Got real today 
rockorocky,,[],61* nice running weather Track time 
rockorocky,,[],Track workouts start tomorrow LEGGO 
rockorocky,,[],Bizzy Body 
rockorocky,SLUFootball,[u'SLUFootball'],Fulfillment of dreams starts tomorrow for future Lions Who's the next great Lion? 
rockorocky,,[],Straight Up 
rockorocky,,[],NYC 
rockorocky,,[],Same ole fools running off at the mouth but don't know this boy right here is straight out the SOUTH 
rockorocky,,[],My words to the youth never give up on your Dreams 
rockorocky,,[],I told a guy to count on me and son lost count 
rockorocky,,[],RT I'm looking for a NET developer in the Atlanta area 70-100k DOE must have bachelors degree with at least 2 years exper 
rockorocky,,[u'AnkerOfficial'],much love to for keeping me charged while on the road 
rockorocky,,[],Bad one on my team just like Katniss Everdeen 
rockorocky,G_Higg,"[u'G_Higg', u'sluathletics']",
rockorocky,,[],Just got some heads up that my old teammate Bryan Bennett showing some good stuff at the Senior Bowl Happy for my Dawg 
rockorocky,PToney,"[u'PToney', u'rockorocky', u'seniorbowl']",Look at Southeastern alum shining on the website 
rockorocky,,[],Mane I'm craving for some Raising Cane's Chicken Fingers 
rockorocky,,[],Only whitney can sing this song 
rockorocky,CoachRonRoberts,[u'CoachRonRoberts'],TRUUUUUUUUUU 
rockorocky,,[],Aiming for the moon if I miss I'll b with the stars 
rockorocky,,[],If I mess with U I'm all the way out there with u if I don't mess with u I don't mind U knowing I don't mess with ya 
rockorocky,,[],
rockorocky,,[u'da_yungin_'],Think they forgot let's make them remember#2015 i'm back@Floater_22 
rockorocky,,[u'BOOSIEOFFICIAL'],On that trouble 
rockorocky,,[u'rockorocky'],RT Everyone just remember that my boy picked off Flacco twice in one game 
rockorocky,,[],Riding on that Nipsey 4 In the Morning 
rockorocky,,[],Hands on the Rollie so I'm just passing thru the time 
rockorocky,,[],What goes up must come down 
rockorocky,SectionI_Row13,"[u'SectionI_Row13', u'rockorocky']",SLU to NFLOur favorite ATL Falcon Robert Alford 
rockorocky,,[],Time for some Therapy 
rockorocky,,[],Back then I was in that Chevy listening to that Savage Life#LouisianaMade 
rockorocky,,[],Mane this would happen when I'm in NYC 
rockorocky,,[],IG rocky_alford23 leggo 
rockorocky,,[],She say what's ur type I said I like what I like 
rockorocky,,[],All my diamonds watching now my watch is getting jealous 
rockorocky,,[],Oregon offense is fast as heck 
rockorocky,,[],2015 
rockorocky,,[],TCU outchea Ballin n the dome 
rockorocky,,[],
rockorocky,,[],Wish I didn't have a season ending injury because I'm tired of reading/hearing about the Panthers repeating 
rockorocky,Pens214,"[u'Pens214', u'rockorocky']",check out what I got for Xmas Hope u have a speedy recovery 
rockorocky,,[u'robertmville'],Think they forgotworkworkwork is what pops taught me 
rockorocky,,[],DON'T BE CONFUSEDDON'T YOU EVERYOU BETTER KNOW REAL#TAT 
rockorocky,,"[u'JWooTV', u'rockorocky']",RT Me and the one-arm yesterday after we smoked those Saints#WeDat 
rockorocky,,[u'CoachRonRoberts'],RT Got to see Rob before the game 
rockorocky,,[u'CoachRonRoberts'],It was good to come home and got to c my old college coach 
rockorocky,,[],Great team win today by my DAWGS 
rockorocky,,[],GameDay 
rockorocky,,[],Da kid is back nothing like home 
rockorocky,,[u'robertmville'],Words from my pops 
rockorocky,,[],Mane I miss being on the field but some things you can't control#TATroad2recovery 
rockorocky,,[],next season will b here n no timeLEGGO 
rockorocky,,[],Greatness is only birthed through inconvenience 
rockorocky,,[],Everything went well now sitting up watching MNF Thanks to everyone for their prayers#RiseUp 
rockorocky,,[],It's bout that time 
rockorocky,,[],Isaiah 4110 
rockorocky,,[],Da Big Apple 
rockorocky,,[],Enemy Turf 
rockorocky,,[],Got people that depend on me can't give up 
rockorocky,,"[u'AllenGWaddell', u'B_BENNETT03']",RT New Signature for my Lion Helmet to go along with 
rockorocky,,[u'SPORTSTARSNYC'],NYC to the Homies 
rockorocky,,[],Happy bday to my mom and auntie love these two best ever 
rockorocky,,[],The will of God won't take U where the Grace of God won't keep U 
rockorocky,,[],My whole mission was to make sho only the realist was going to rock with me#TAT 
rockorocky,slay_darius,[],
rockorocky,,[],Just talk with my Dawg always YA heard me 
rockorocky,,[],You have to Pray as everything depend on God but you have to act as everything depends on You 
rockorocky,,[],Stand on principles homie#BBcrew 
rockorocky,,"[u'OREFICIWATCHES', u'neimanmarcus']",Check out my good friends today and tomorrow ATL 
rockorocky,,[],75 outside love it YA heard me 
rockorocky,Floater_22,[u'Floater_22'],Yeaaaa Budddyyyy 
rockorocky,DariusJButler,[u'DariusJButler'],need that connect Homie 
rockorocky,,[],Scarface before he died then Part2 
rockorocky,,"[u'Floater_22', u'favor_Island', u'cdoubleU_5']",Bout to quite these haters@Floater_22 
rockorocky,Floater_22,[u'Floater_22'],But I'm still rocking wit lil bro Tho 
rockorocky,Floater_22,[u'Floater_22'],YEEEEEELLLLPPPP 
rockorocky,DeAndreHopkins,[u'nukdabomb'],Wrong Homie 
rockorocky,,[],Only focus is to get back out there with my homies to win the NFC south plenty counted us out but ITs Time Ya heard me#RiseUp 
rockorocky,,[u'CoachRonRoberts'],The Homies back to back Southland Conference Champs Proud of'em 
rockorocky,,"[u'kristenm2185', u'DesmondTrufant', u'rockorocky']",RT Nice lookin picture 
rockorocky,,[],God never Sleep I'm a blessed individualminor setback for a major comeback#RiseUp 
rockorocky,rockorocky,[u'rockorocky'],Good team win today I'm so proud of my homies#DivisionLeaders 
rockorocky,,[],1 John 44 
rockorocky,,[],Thanking God for letting me c another day#GameDay 
rockorocky,,[],Im Wit Ya I kno that feeling Im Wit Ya I kno that feeling 
rockorocky,robertmville,[u'robertmville'],YES SIRRR POPS ITS THAT TIME AGAIN 
rockorocky,,"[u'CoachRonRoberts', u'JayArtigues']",Lion up and Beat the Cowboys today boys 
rockorocky,,[],Don't work to prove men wrong Work to prove God right 
rockorocky,,[u'DeionSanders'],RT A New Beginning &amp; a 2nd chance is all u need Change yo phone process and ultimately your life New day 
rockorocky,,[u'Realrclark25'],Talking to big bro I could always go to him bout anything been sense Day 1 
rockorocky,,[],Going to c it clear 
rockorocky,,[],Happy Bday to my grandmother gone but never forgottenIMY Nellie-B 
rockorocky,,[],Much love to the people at for the workout bench Check them out 
rockorocky,,[],HardlyHardlyHardlyHardly 
rockorocky,,[],It's going down where I roam in that SSB 
rockorocky,,[],Philippians 46 Do not be anxious about anything but in every situation by prayer and petition with 
rockorocky,,[],Boosie- life that I dreamed of where I'm from we dream this here Ya heard me#StraightUp 
rockorocky,,[],Proverbs 2229 Do you see a man who excels in his work? He will stand before kings 
rockorocky,Tkunodos,[u'Tkunodos'],STRAIGHT UP@TKUnoDos Boosie &amp; Trey killed that FaceTime whoa 
rockorocky,,[u'Mathieu_Era'],Seen my Dawg got a INT today#BootBoys 
rockorocky,,[],Good to b back home this weekend to c family#LouisianaBoy4life 
rockorocky,,[u'rockorocky'],RT Happy birthday 
rockorocky,,[u'SPORTSTARSNYC'],RT Happy Birthday CB 
rockorocky,,[],I could eat breakfast all day YA heard me 
rockorocky,Outa_Your_Reach,[u'Outa_Your_Reach'],
rockorocky,Outa_Your_Reach,[u'Outa_Your_Reach'],heyheyhey nah over there U two 
rockorocky,,[],I'm coming home wait for me 
rockorocky,,[u'OutdoorTech'],Sound from these is amazing Love using it BIG shoutout to for hooking it up 
rockorocky,,[u'Realrclark25'],Ready to watch big bro take the field tonight 
rockorocky,,[],1 Thessalonians 511 Therefore encourage one another and build one another up just as you are doing 
rockorocky,,[],Play list &gt;&gt;&gt; Donnie McClurkin Stand 
rockorocky,,[],GameDayThanking the man above 
rockorocky,,"[u'joanncantu', u'rockorocky']",RT looks focused 
rockorocky,,[],LondonUK 
rockorocky,,[],Gladiators on deck 
rockorocky,,[],Galatians 69 Let us not grow weary while doing good 
rockorocky,,[],Isaiah 608 Who are these that fly like a cloud and like doves to their windows? (Those who don't jump will never fly It's time to jump) 
rockorocky,,[],London 
rockorocky,,[u'beinSCOOTERBUIE'],RT Today I will do what others won't so tomorrow I can accomplish what others 
rockorocky,,[],1 John 44 
rockorocky,,[],But mama I ain't done yet sit back and watch your sunrise Kick back and know your sunset 
rockorocky,,[],GoodLuck to my boys today SLU 
rockorocky,,[u'Mathieu_Era'],RT Shoutout to my haters 
rockorocky,,[],Hamm Town Stand Up Not to many people make it out where I'm from YA heard me#Blessed 
rockorocky,,"[u'nyglass', u'sunskis']",Big thanks to the sunglass kings for the 
rockorocky,,[u'mackweldon'],sending some love back to my friends -So comfortable Great stuff for the w 
rockorocky,,[],It's the Benediction so I gave u my testimony 
rockorocky,,[],Terio 
rockorocky,,[],Boosie 
rockorocky,,[],That boy Doug E fresh Da Realest 
rockorocky,,[],Long as u know That God is for you it doesn't matter who is against you#SimpleFact 
rockorocky,,[],You never know how the small simple things will make someone's day 
rockorocky,,[u'Mathieu_Era'],Straight UpRT Going your own way can be lonely at times but can take you to a glorious destination 
rockorocky,,[],For where you have envy and selfish ambition there you find disorder and every evil practice (James 316 
rockorocky,,[],Kno what u talking about before speaking 
rockorocky,,[],With GOD all things are possible 
rockorocky,,[],Salute to everybody that salute to me#TAT 
rockorocky,,[],Stop looking for a herobecome one 
rockorocky,,[],Taste and see that the Lord is good; blessed is the one who takes refuge in him (Psalm 348 
rockorocky,,[],What it Beez LikeBeez like 
rockorocky,,[u'CoachRonRoberts'],Happy Bday to my ole ball coach one of the best coaches out there 
rockorocky,,[],Riding around with my top down so I'm closer to God 
rockorocky,Duke27_,"[u'Duke27_', u'Gragg80']",already brodie 
rockorocky,Duke27_,[u'Duke27_'],haha u don't need that foolie 
rockorocky,,[],The Lord is far from the wicked but he hears the prayer of the righteous 
rockorocky,so_amazing25,[u'so_amazing25'],straight up 
rockorocky,,[],God is Good#TAT 
rockorocky,,[u'Realrclark25'],RT Work day It's a great day to be alive 
rockorocky,,[],Hustle High Hat LowRumble young man Rumble#TAT 
rockorocky,,[],Note A true champion can take a loss and bounce back 
rockorocky,,[],Watching my youngin 
rockorocky,,[],NYCYA HEARD ME 
rockorocky,,[u'SPORTSTARSNYC'],Shoutout to the agency in the game today 
rockorocky,,"[u'rockorocky', u'Bose']",RT Get pumped for tomorrow's game with Gameday Playlist 
rockorocky,Mathieu_Era,[u'Mathieu_Era'],If they don't believe in you don't be upset 
rockorocky,,[],They say the proof is in the pudding if u don't c it I guess u ain't looking#YaDig 
rockorocky,,[],A Real brother don't talk bout it he just going to b bout it 
rockorocky,ReedRoberts_14,"[u'ReedRoberts_14', u'rockorocky']",high school days HHS So I got physics book 
rockorocky,,[],Massage time 
rockorocky,,[],LEGGO with my boy after the TDBack to Work TODAY 
rockorocky,,[],Just heard Da Boot finally have BER ya heard methat's we need that StraightUp 
rockorocky,,[],Maze runners was a good movie 
rockorocky,,[],We them boys 
rockorocky,,[u'D_Hest23'],Good to share this moment with my dawg breaking Deion record is a high accomplishment Proud 
rockorocky,,[],Back like I never left#TAT 
rockorocky,,[],You don't know my struggle so u can't feel my hustleboosssssssie 
rockorocky,AtlantaFalcons,[u'NFLFilms'],YEA BUDDY Falcons vs Bucs previews the matchup 
rockorocky,,[],Major comebackit's levels 
rockorocky,Floater_22,[u'Floater_22'],u knw it bro 
rockorocky,,"[u'JSwaff19', u'rockorocky']",RT 
rockorocky,robertmville,"[u'robertmville', u'HighRizer38']",I'll catch him pops 
rockorocky,,[],Everything happens for a reason but one play don't make RA#TAT 
rockorocky,,[],Watching my boys tonight 
rockorocky,,[],It's cold outchea n Cincy 
rockorocky,_B_Jibor,[],after 
rockorocky,,[],Time for some zzzz's 
rockorocky,HammondHighFB,"[u'HammondHighFB', u'rockorocky']",A shoutout to former Hammond high star and now in the NFL Keep working hard 
rockorocky,,[],Great team win today#RiseUp 2014 
rockorocky,,"[u'21dirtybird', u'rockorocky']",RT Thanks for signing a bayou dirtybirds gloves 
rockorocky,,[],Heart of a Lion 
rockorocky,,[],Lets Go 
rockorocky,,[],I love my hometown but tomorrow I have to go against the hometown team#RiseUp 
rockorocky,,[],Madden is funny C'mon man 
rockorocky,,[u'Floater_22'],RT Game Week Who going 2 WIN SaintsVsATL 
rockorocky,,[],Pappadeaux Seafood Kitchen 
rockorocky,,[u'ESPNCFB'],TOP 3 Here's the latest Coaches' Poll No surprise that North Dakota 
rockorocky,,[],Days until kickoff 
rockorocky,,[],We were down from the beginnin' When the world wasn't listenin' Now that I got your attention Let us end with the benediction#TAT 
Ricardo37Allen,,[],Never looking for a handout 
Ricardo37Allen,J_HILL_47,[u'J_HILL_47'],Happy birthday bro 
Ricardo37Allen,,[u'PatMcAfeeShow'],RT This lady is wearing a Deadliest Catch fishing net I think 
Ricardo37Allen,Keith_Carlos,[u'Keith_Carlos'],Hard work paying off bro Keep at it man 
Ricardo37Allen,,[u'Keith_Carlos'],RT First male and African American Male to win Americas Next Top Model and to land a Guess Campaign http 
Ricardo37Allen,BoilerLisa,[u'Ricardo37Allen'],he got robbed for Pop Album of the year Everything has become too political 
Ricardo37Allen,,[],Ed Sheeran has some of the best music I heard in a while 
Ricardo37Allen,SHANEWYNN4,[u'SHANEWYNN4'],watching it now 
Ricardo37Allen,SHANEWYNN4,[u'SHANEWYNN4'],bro I'm going to be addicted to this show haha 
Ricardo37Allen,SHANEWYNN4,[u'SHANEWYNN4'],haha I'm looking for something good too Let me know once you find out 
Ricardo37Allen,SHANEWYNN4,[u'SHANEWYNN4'],bro prison break is on point 
Ricardo37Allen,,[],
Ricardo37Allen,,[],The need to call Kearse the finisher 
Ricardo37Allen,,[],The 4th quarter killer KEARSE 
Ricardo37Allen,,[],From working at footlocker to given that boy 3 catches- 100yrds 
Ricardo37Allen,PrspCntSports,[],what's up bro Dm me your number 
Ricardo37Allen,K_Drummond23,[],Happy Bday bro Keep grinding 
Ricardo37Allen,,[],Matt Ryan offensive mvp 
Ricardo37Allen,,[],Grimes should be Defensive mvp 
Ricardo37Allen,MattHazel_,[u'MattHazel_'],yea 
Ricardo37Allen,,[],ICE ICE BABY 
Ricardo37Allen,,[],Y'all heard my boy CALM DOWN 
Ricardo37Allen,CoreyWhiteJr3,[u'CoreyWhiteJr3'],you in there tomorrow? 
Ricardo37Allen,,[u'gracious1312'],RT the same boiling water that softens the potato hardens the egg 
Ricardo37Allen,,[u'JSinz84'],RT Did Not Think It Could Get Any Worse Than The Fail Mary It Just Did 
Ricardo37Allen,,[],I feel it for the bostick dude 
Ricardo37Allen,ChuckT17,[u'ChuckT17'],lol dang bro that's crazy 
Ricardo37Allen,,[u'ChuckT17'],R-E-L-A-X did a little too much of that 
Ricardo37Allen,,[],Ball game 
Ricardo37Allen,sbp_21,[u'spncrpatterson'],that sucks 
Ricardo37Allen,,[],I wonder how many Seahawks fans are locked out the stadium for leaving 
Ricardo37Allen,Beanzz16,[u'b_fowler13'],ONLY YOU LOL Somebody hit the button at Buffalo Wild Wings haha 
Ricardo37Allen,,[],I'm scared for this kicker 
Ricardo37Allen,,[],The one arm Sherman makes a key play 
Ricardo37Allen,Rom34Smith,[u'Ricardo37Allen'],Not on duty not on dutyRT@Rom34Smith somebody say madden 
Ricardo37Allen,Run_jmg39,[],LOL RT@JoeGotti_39 Someone gave the fat lady some food and she stopped singing lol 
Ricardo37Allen,,[],This is the type of stuff I do when I play madden 
Ricardo37Allen,,[],What just happen? 
Ricardo37Allen,49foyamind49,"[u'49foyamind49', u'HamzaAbdullah21']",LOL RT@49foyamind49 Exactly wht they did lol RT Onside Kick it to the guy with the cleanest uniform 
Ricardo37Allen,,[],Uh that bike 
Ricardo37Allen,,[],Wow 
Ricardo37Allen,ChuckT17,"[u'ChuckT17', u'bnasty90']",I feel that Him and mike Neal will 
Ricardo37Allen,BrianJColombo,[u'BrianJColombo'],its 500x better than WL 
Ricardo37Allen,ChuckT17,"[u'ChuckT17', u'bnasty90']",you tagging him don't say anything You might have both your teams in the super bowl though 
Ricardo37Allen,,[],He tried to FINISH HIM (mortal kombat style) 
Ricardo37Allen,,[],Getting ugly out there 
Ricardo37Allen,,"[u'c_singleton', u'Ricardo37Allen']",RT Thank you guys with and his lovely fiancee Grace at 
Ricardo37Allen,Singytweets,[u'c_singleton'],thanks for having us 
Ricardo37Allen,ChuckT17,[u'ChuckT17'],Boy you still got that Packers jersey in your closet RT 
Ricardo37Allen,,"[u'gracious1312', u'RKRelentless', u'Ricardo37Allen']",RT So excited for to show the world today and I will be watching 
Ricardo37Allen,,"[u'Cody_Fox5', u'Ricardo37Allen']",RT At the charity event 2nite and poor had to hold his girls bag and jacket waiting for her We've all been the 
Ricardo37Allen,,"[u'gracious1312', u'Ricardo37Allen']",RT hustle beats talent when talent doesn't hustle (&amp; we hustle hard 
Ricardo37Allen,,[],Enjoy the development of life 
Ricardo37Allen,,[u'xtremeg10'],RT When Urban Meyer starts spring ball and says 1st team out which quarterback goes out there? 
Ricardo37Allen,SeanManning_DP,[u'SeanManning_DP'],you're salty 
Ricardo37Allen,_Tierrasobougie,[],ok 
Ricardo37Allen,,[],B1G 
Ricardo37Allen,_Tierrasobougie,[],you felt some type of way about that last tweet lol 
Ricardo37Allen,TheRealMissJude,[u'hillboy345'],lol I know 
Ricardo37Allen,,[],Ohio state needs to play their back ups Oh they are already on their 3rd string qb My bad 
Ricardo37Allen,DEvans345,[u'hillboy345'],can't say what I want to on here lol To be continued 
Ricardo37Allen,,[u'49foyamind49'],RT My man from TAKEN on Oregon sideline just told the defense GOOD LUCK 
Ricardo37Allen,DEvans345,[u'hillboy345'],wrong 
Ricardo37Allen,,[u'elguapo'],That boy look like a young 
Ricardo37Allen,,[],That's one of the dumbest things you can do 
Ricardo37Allen,,[],15 about that action boss 
Ricardo37Allen,,[],Lol he put that HAT on buddy 
Ricardo37Allen,DKleinWriter,[u'DKNewsJournal'],everyone wants to know someone that knows someone If he was still in Daytona no one would care Sad thing about life 
Ricardo37Allen,,[],Give him the business lil bro 
Ricardo37Allen,,[],None of these refs are on the same page lol 
Ricardo37Allen,DaRealKingKutty,[u'DaRealKingKutty'],why is that not the same we aren't talking about the position on the field we are talking about the catch 
Ricardo37Allen,KyleYourFriend,[],I'm a Db heck no lol 
Ricardo37Allen,Realrclark25,[u'Realrclark25'],Well guess these guys didn't get invited on the party bus Lol 
Ricardo37Allen,,[],Calvin Johnson rule Only thing that helps db's 
Ricardo37Allen,,[],Catch or no Catch? 
Ricardo37Allen,chewy_boy,[u'chewy_boy'],nice tape keep working and everything will work out 
Ricardo37Allen,,"[u'gracious1312', u'weebly']",RT perfectionism and people pleasing 
Ricardo37Allen,,[],Thanks for the letter 
Ricardo37Allen,,[],My ambition is my weaponry 
Ricardo37Allen,,[],WE DAT 
Ricardo37Allen,,[u'M_Ryan02'],RT Shop with a Pro tonight hosted by 
Ricardo37Allen,do6SON,[u'do6SON'],no need to I do this because I love it not to prove who's right or wrong 
Ricardo37Allen,GainesTrain_31,[u'GainesTrain_31'],appreciate it bro 
Ricardo37Allen,,[u'Ricardo37Allen'],RT Falcons move CB to the active roster 
Ricardo37Allen,,[],You're not rich until you have something that money can't buy 
Ricardo37Allen,ROBERTSON_9TWO,[u'ROBERTSON_9TWO'],happy bday big dog miss you over here man Keep balling and know that God has a plan for you 
Ricardo37Allen,gracious1312,[u'gracious1312'],we have her mad 
Ricardo37Allen,,[u'gracious1312'],RT does anybody else watch/try to learn YouTube dance tutorials with their sig other at 1058pm on a Sunday? oh 
Ricardo37Allen,FYF_CEO,[u'FYF_CEO'],yall poo Yall got it though 
Ricardo37Allen,Blooded_Cold26,[],it's easy to stay and watch when they winning 
Ricardo37Allen,Blooded_Cold26,[],Bucs fans pulling a Miami Heat vs San Antonio Spurs smh Thats daytona for you bro 
Ricardo37Allen,FYF_CEO,[u'FYF_CEO'],them boys poo 
Ricardo37Allen,,[],Buc pride never dies 
Ricardo37Allen,AColvin_22,[u'AColvin_22'],crazy man I feel bad for buddy 
Ricardo37Allen,,"[u'gracious1312', u'Ricardo37Allen']",RT I'm pretty sure made my Uggs magically disappear he (like most guys) doesn't understand comfort &gt; f 
Ricardo37Allen,,[u'TonyJefferson1'],It was good to see my bro in action Keep balling bro 
Ricardo37Allen,Frankcorporate1,[],because the world revolves on publicity and ticket sells bro 
Ricardo37Allen,,[u'BleacherReport'],RT VIDEO Steph Curry and his wife created a Chef Curry with the Pot remix 
Ricardo37Allen,,[u'Shrine_Game'],RT Ryan Russell from Purdue has accepted the invitation to play in the 2015 
Ricardo37Allen,,[],Whats heavier a pound of cotton or a pound of stone? 
Ricardo37Allen,,[],Great team win tonight 
Ricardo37Allen,,[u'gracious1312'],RT It's game day Let's go 
Ricardo37Allen,,[],Let's go Purdue Bring back that Old Oaken Bucket today 
Ricardo37Allen,,[u'FLgridironpreps'],RT 6A REGIONAL FINAL Mainland Buccaneers 14 South Fort Myers Wolfpack 0 3RD QTR 
Ricardo37Allen,,[],Black Friday is the time you need a handicap sticker This guy lol 
Ricardo37Allen,CoachMcDaniel_,"[u'coach_mac98', u'gracious1312']",thanks bro 
Ricardo37Allen,rramer43,[u'rramer43'],thanks bro and I will 
Ricardo37Allen,codywebster42,"[u'codywebster42', u'gracious1312']",thanks bro 
Ricardo37Allen,JaeDotDee,[u'JaeDotDee'],thanks bro 
Ricardo37Allen,,[],Fun fact You can't stop my grind the cream always rises to the top 
Ricardo37Allen,,[],If there's a will There's a way 
Ricardo37Allen,,[u'FalconsCR'],RT Rookie Club and vets serve Thanksgiving dinner at Crossroads Community Ministries 
Ricardo37Allen,JaeDotDee,[u'JaeDotDee'],watch it lol 
Ricardo37Allen,,[],Tough times don't last tough people do 
Ricardo37Allen,,[],I still give them motivation even when I know they hating 
Ricardo37Allen,,[],Just believe in the process 
Ricardo37Allen,,[],Don't allow success to stop your grind 
Ricardo37Allen,ace2awh,"[u'ace2awh', u'TacoMacGmall']",they were really good how was your meal? 
Ricardo37Allen,,[],When someone shows you who they really are believe them 
Ricardo37Allen,,[],If you give up on yourself there's no hope 
Ricardo37Allen,,[],New week New Goal 
Ricardo37Allen,Beanzz16,[u'b_fowler13'],that movie is amazing bro 
Ricardo37Allen,,[],The fear of failure is the greatest single obstacle to success 
Ricardo37Allen,,[u'Oneway_Reedy'],RT One game at a time 
Ricardo37Allen,,[u'Rom34Smith'],RT Good Win today 
Ricardo37Allen,,[u'Lady_Kay28'],RT 
Ricardo37Allen,,[],1st place NFC south 
Ricardo37Allen,,[],Turn up Another W in the books 
Ricardo37Allen,,[],Good red zone stand D 
Ricardo37Allen,,[],The meanest double move lol 
Ricardo37Allen,,[],Miami vs Fsu Who do you have? 
Ricardo37Allen,,[],Believe in the process 
Ricardo37Allen,,"[u'Oneway_Reedy', u'Rom34Smith']",BUT TODAY I GOT TIME 
Ricardo37Allen,,[],Free Your Mind 
Ricardo37Allen,,[],Never lose your edge 
Ricardo37Allen,,"[u'ShepherdCenter', u'ShepherdCenter', u'AtlantaFalcons_']",RT patient Thomas Smith and others enjoyed a visit from rookies 
Ricardo37Allen,,[],Don't take anything for granted 
Ricardo37Allen,,[],Let's go boys let's finish this season off the right way 
Ricardo37Allen,,[u'GainesTrain_31'],RT Pretty girls be single cuz they all think they IG models lol 
Ricardo37Allen,,[],Every top dog was once the underdog It all a process 
Ricardo37Allen,,[u'Mr_A1Hunt'],RT Respect is not JUST given 
Ricardo37Allen,,[],no fly zone 21 
Ricardo37Allen,CrowGhost21,[],no fly zone 21 
Ricardo37Allen,,[],Xbox1 
Ricardo37Allen,Falconfan77,[u'Falconfan77'],xbox1 
Ricardo37Allen,TOLYATHAT,[u'TOLYATHAT'],xbox 
Ricardo37Allen,,[],I need call of duty partners 
Ricardo37Allen,,[u'VBentley_2'],Happy birthday bro 
Ricardo37Allen,,[u'BleacherReport'],RT Devon Still's daughter will watch her dad play in person for the 1st time on Thursday 
Ricardo37Allen,,[],Never look down on anyone unless you're helping them up 
Ricardo37Allen,,"[u'gracious1312', u'Ricardo37Allen']",RT because I love yah 
Ricardo37Allen,,[],Buc Pride never dies Proud of my lil bros 
Ricardo37Allen,ChuckTooraw,[u'ChuckTooraw'],I know that's what you would like but NOT GOING TO HAPPEN 
Ricardo37Allen,,[],Let's go mainland 
Ricardo37Allen,,"[u'holcombe73', u'Ricardo37Allen', u'PUDM']",RT could you help Purdue Dance Marathon beat IU? 
Ricardo37Allen,,[],I wonder how many people in the world are mad at him for dropping the ball lol 
Ricardo37Allen,,"[u'DBNJSports', u'MAINLANDBUCS']",RT still No 1 in state 6A football poll Updated polls 
Ricardo37Allen,,[],Keep it 100 since the day I came through 
Ricardo37Allen,Johnygonzo,[u'Johnygonzo'],thanks I appreciate it a lot God has his plan I just have to keep believing and following 
Ricardo37Allen,,[u'K_mar7'],Y'all follow my boy 
Ricardo37Allen,,[],Some people dream of success while others wake up and work hard at it 
Ricardo37Allen,codywebster42,"[u'codywebster42', u'Ricardo37Allen']",lmao just kidding man you're awesome I love youlol I know I'm not saying I love you on social media 
Ricardo37Allen,codywebster42,"[u'codywebster42', u'Ricardo37Allen']",dude maybe we were the problem at Purdue speak for yourself lol 
Ricardo37Allen,,[u'GoldandBlackcom'],RT leads Minnesota 31-20 at half 
Ricardo37Allen,,[],9 plays 100% run let's go Purdue 
Ricardo37Allen,,[u'DannyAnthrop'],Let's go 
Ricardo37Allen,,[u'DKNewsJournal'],RT The top three is still all Mainland with Will Collins (423 4 TDs) and Kaylo Hannah (196 
