screen_name,in_reply_to_screen_name,mentions,full_text
CoreyPeters91,,[u'lp_thatsme'],who won Missed the game 
CoreyPeters91,ThomasBowling17,[],thank you 
CoreyPeters91,Kingamongpawns,[u'Kingamongpawns'],lol I like pitino Most times I look at the roster he has and am impressed by what he gets out of the players 
CoreyPeters91,Kingamongpawns,[u'Kingamongpawns'],Naw We're just a better team Yall had a better team in football 
CoreyPeters91,Renagade3200,[u'Renagade3200'],
CoreyPeters91,,[u'Chief_Griffin'],you a louisville fan today??? 
CoreyPeters91,_iDonisha,[u'_iDonisha'],you ready to take that L 
CoreyPeters91,4Ever_bSHAW,"[u'4Ever_bSHAW', u'Brittney309']",y'all need to get on board Lol 
CoreyPeters91,DancinRick20,[u'DancinRick20'],lol We won I'm just chillin on the bus 
CoreyPeters91,,[u'Rashedehageman'],Shout out to my guy you came a long way bro Proud of you 
CoreyPeters91,,[u'Macys'],Cant get enough of HUGO RED from Keeps me smelling sharp both on and off the field 
CoreyPeters91,krissybri,[u'krissybri'],what do u want them to do??? 
CoreyPeters91,CookieByNature,[],oh I don't have anything to do with that 
CoreyPeters91,CookieByNature,[],I must have missed something 
CoreyPeters91,CookieByNature,[],speak up and say what 
CoreyPeters91,,[u'Macys'],Going over game plan for Sunday Working hard smelling better Check out HUGO MAN at for the Holidays 
CoreyPeters91,,"[u'_ctkg', u'_iDonisha']",RT Lol 
CoreyPeters91,krissybri,[u'krissybri'],u suppose to be cooking along 
CoreyPeters91,,[u'Chief_Griffin'],I carried u fool 
CoreyPeters91,AdamJournalism1,[u'AdamJournalism1'],please educate me 
CoreyPeters91,,[],This college football playoff is going to be much more messy than the bcs was 
CoreyPeters91,,[],Great team win today All three phases played well vs a very good football team 
CoreyPeters91,BFinn86,[u'BFinn86'],did I look kinda athletic? 
CoreyPeters91,LikeNo_Other96,[],
CoreyPeters91,LikeNo_Other96,[],I don't wanna hear it I'm from Louisville too What that gotta do with the school 
CoreyPeters91,LikeNo_Other96,[],I thought u were a bama fan You are dismissed 
CoreyPeters91,HDouglas83,"[u'HDouglas83', u'iHeartMiko']",
CoreyPeters91,iHeartMiko,"[u'iHeartMiko', u'HDouglas83']",yep I hate the university of Louisville 
CoreyPeters91,,[],How are we leaving Parker this open? He needs 2 people every play 
CoreyPeters91,,[],Let's go Kentucky 
CoreyPeters91,KySportsRadio,[u'KySportsRadio'],nothing but defense 
CoreyPeters91,Renagade3200,[u'Renagade3200'],y'all bout to take this L 
CoreyPeters91,,[],Friday night lights Buford is looking good Buford High School Tom Riden Stadium 
CoreyPeters91,,"[u'sduff1', u'CoreyPeters91']",RT get the word out Central football on Sports Center's Top 10 as Now up for Best of the Best Vote 
CoreyPeters91,,[u'macy'],The secret to a solid post game interview? Boss Bottled from 
CoreyPeters91,JWILL_88,[u'JWILL_88'],i like college football Nothing more Nothing less 
CoreyPeters91,CoachWright37,[u'CoachWright37'],you the busy one hit me up tonight man 
CoreyPeters91,JWILL_88,[u'JWILL_88'],why you concerned with UK bro You tryna become a fan? 
CoreyPeters91,,[],Pretty sure I just saw Tim Riggins playing for Notre dame 
CoreyPeters91,chadmbreen,"[u'chadmbreen', u'agentlinton']",you know better than that chad 
CoreyPeters91,,[u'TailgateTeam'],I'll be joining the tonight at the Publix in Alpharetta from 5-7 Come see us at 5180 McGinnis Ferry 
CoreyPeters91,,"[u'CoreyPeters91', u'TailgateTeam', u'Publix']",RT DT will be with the Falcons at the in Alpharetta (5180 McGinnis Ferry Rd) tonight 
CoreyPeters91,Close2myDreams,[u'Close2myDreams'],you do look like dude in that movie 
CoreyPeters91,_britt_rebeccA,[u'_britt_rebeccA'],I'm glad that they behaved the way I taught them to Lol 
CoreyPeters91,jmcc65,[u'jmcc65'],chill bro 
CoreyPeters91,,[],Mississippi st is done man 
CoreyPeters91,jmcc65,[u'jmcc65'],I'm bout to report y'all for child abuse Get that baby some decent clothes 
CoreyPeters91,krissybri,[u'krissybri'],hey mom 
CoreyPeters91,the1andonlyCN2,[u'the1andonlyCN2'],lol 
CoreyPeters91,,[u'BleacherReport'],RT VIDEO Lee Corso picked Michigan State over Ohio State by screaming THIS IS SPARTA 
CoreyPeters91,krissybri,[u'krissybri'],what's the name on the account? 
CoreyPeters91,,[u'childrensatl'],Happy The Falcons are proud to support 
CoreyPeters91,,[u'Liberiangyal'],RT LMFAO RT I AM DONE 
CoreyPeters91,Kingamongpawns,[u'Kingamongpawns'],idk about all that Y'all took advantage of some mistakes but I think fsu is clearly the better team 
CoreyPeters91,Kingamongpawns,[u'Kingamongpawns'],who??? 
CoreyPeters91,,[],Ballgame 
CoreyPeters91,,[u'lp_thatsme'],
CoreyPeters91,,[u'FascinatingVids'],RT RT if you are surprised 
CoreyPeters91,HarlemKnightt,[u'HarlemKnightt'],she alright for what she is but she ain't all that 
CoreyPeters91,HarlemKnightt,[u'HarlemKnightt'],calm down 
CoreyPeters91,,[u'SHOATL'],Doing some work with today Check them out and give them a follow 
CoreyPeters91,,[u'Chief_Griffin'],you a lie cause I know better than to ask you for food 
CoreyPeters91,Close2myDreams,[u'Close2myDreams'],that movie terrible 
CoreyPeters91,Close2myDreams,[u'Close2myDreams'],terrible 
CoreyPeters91,,[u'rylee_ice'],you know I will 
CoreyPeters91,,[],Great day to be a KENTUCKY WILDCAT 
CoreyPeters91,,[u'lp_thatsme'],bandwagon is full You can try and run behind it 
CoreyPeters91,Close2myDreams,[u'Close2myDreams'],it's so gross 
CoreyPeters91,,[u'Rand_Getlin'],RT FB John The Terminator Conner has signed a one-year deal with the per a league source 
CoreyPeters91,JusCallMeG,[u'JusCallMeG'],be nice 
CoreyPeters91,dunamisbeats,[u'dunamisbeats'],I agree We getting back to work 
CoreyPeters91,lilmiss_jordan,[u'lilmiss_jordan'],not here Lol When I was younger 
CoreyPeters91,lilmiss_jordan,[u'lilmiss_jordan'],gonna cuss them out in the car 
CoreyPeters91,lilmiss_jordan,[u'lilmiss_jordan'],pretty much the only way that ima fight is if I'm with friends and they get into a fight I'm gonna get involved but I'm 
CoreyPeters91,lilmiss_jordan,[u'lilmiss_jordan'],lol No but I'm to old to be fighting over stupid stuff 
CoreyPeters91,lilmiss_jordan,[u'lilmiss_jordan'],no and no 
CoreyPeters91,,[u'lp_thatsme'],did u at least get his number 
CoreyPeters91,MissHolloman,[u'MissHolloman'],that's what's up Very happy for you 
CoreyPeters91,MissHolloman,[u'MissHolloman'],everything is going well How are you 
CoreyPeters91,,[u'lp_thatsme'],time warner is a good job though 
CoreyPeters91,MissHolloman,[u'MissHolloman'],what's up 
CoreyPeters91,,[u'lp_thatsme'],don't miss ur blessing Lol 
CoreyPeters91,,"[u'StrikesForKids', u'SeanWSpoon56']",RT Come bowl along side on Monday Oct 13th at Stars &amp; Strikes in Dacula 
CoreyPeters91,,[u'Chief_Griffin'],I see u tryna step ur swag up 
CoreyPeters91,,[u'BleacherReport'],RT VIDEO The most positive HS football player gives an extremely spirited postgame speech 
CoreyPeters91,Kriddah3183,[],wow Smh 
CoreyPeters91,,[],RT RIP Rob Bironas May God be with his family for comfort and peace during this time 
CoreyPeters91,ROBERTSON_9TWO,[u'ROBERTSON_9TWO'],you are soooo fat 
CoreyPeters91,,[],Breakfast is the best meal of the day J Christopher' Brunch Savannah GA 
CoreyPeters91,agentlinton,[u'agentlinton'],I did that in high school once It was a jv game Threw on some tennis shoes and put that work in 
CoreyPeters91,HangNwitCoop,[u'HangNwitCoop'],did I see u on the jumbo tron last night 
CoreyPeters91,ZippDuncan,[u'ZippDuncan'],I know hate is the way you show love Zipp So I love you too 
CoreyPeters91,lilmiss_jordan,[u'lilmiss_jordan'],lol 
CoreyPeters91,,[],Have been a crutch for me to lean on I'll never forget that and I am forever grateful 
CoreyPeters91,,[],On a more personal note I'd like to thank every one for their support through the injury Been a roller coaster of emotions and many of you 
CoreyPeters91,,[],It was so much fun getting back on the winning track The dome was crazy last night Thanks to all the fans that came out and supported 
CoreyPeters91,NewmanShow99,[u'iRJerrell99'],lol I'm kidding But would love to see you do ur thing Love to see people doing different things 
CoreyPeters91,NewmanShow99,[u'iRJerrell99'],well go to the mirror and text me a video of like 5 minutes I'm a comedy expert It's what I do in my spare time Do it now 
CoreyPeters91,NewmanShow99,[u'iRJerrell99'],is there video of this 
CoreyPeters91,ASprattJones,[u'ASprattJones'],you mad? Or nah 
CoreyPeters91,jazloveslj,[u'jazloveslj'],who knows But I know something that already happened 
CoreyPeters91,TweetItHowULive,[u'TweetItHowULive'],it depends on their attitude They gotta go at Florida neck 
CoreyPeters91,TweetItHowULive,[u'TweetItHowULive'],you need some cheering up huh? It's gonna be ok 
CoreyPeters91,jazloveslj,[u'jazloveslj'],a lot can happen in 3 hours 
CoreyPeters91,Renagade3200,[u'Renagade3200'],listen man We undefeated right now and y'all not Ain't nothing you can say that can change that 
CoreyPeters91,HOTLANTA_MAN,[u'HOTLANTA_MAN'],we gotta find a way to get a win in Gainesville as well 
CoreyPeters91,_iDonisha,[u'_iDonisha'],maybe a little 
CoreyPeters91,,[],A Louisville loss would make me very happy today 
CoreyPeters91,Close2myDreams,[u'Close2myDreams'],ok 
CoreyPeters91,Close2myDreams,[u'Close2myDreams'],you in town? Come thru 
CoreyPeters91,Close2myDreams,[u'Close2myDreams'],keep it moving People here don't like u 
CoreyPeters91,,[u'FalconsCR'],RT Gatorade Junior Training Camp visited Walters Boys&amp;Girls Club w/ &amp; 
CoreyPeters91,,[],Positivity is the key to happiness I'm convinced at this point Nothing is ever gonna be perfect 
CoreyPeters91,TweetItHowULive,[u'TweetItHowULive'],call me 
CoreyPeters91,,[],Why are athletic directors on the selection committee for the college football playoff 
CoreyPeters91,,[u'NiggasBLike'],RT BOBBY SHMURDA'S CAT 
CoreyPeters91,,[u'WillyMo_25'],RT Our fans had the Dome Rockin' today Thank y'all we needed that 
CoreyPeters91,,[u'RallyFoundation'],RT Rally Kid Brayden earned his angel wings this morning- Pls join us in keeping Brayden's family in your prayers http/ 
CoreyPeters91,,"[u'winstonguyjr27', u'rcobb18']",RT Good luck to my brotha tonight vs the Seattle Seahawks 
CoreyPeters91,,[u'SportsCenter'],RT MUST WATCH Team USA reacts to New Zealand's pregame Haka before their FIBA Basketball World Cup game today 
CoreyPeters91,krissybri,[u'krissybri'],no 
CoreyPeters91,JDrumUK,[u'JDrumUK'],like Oregon 
Qui22Rodgers,_AYoungYaga,[u'_AYoungYaga'],dm me her number 
Qui22Rodgers,ksea43,[u'ksea43'],I'm glad you agreeing with meok you beat me in 3pt around the world I'm a better in game shooter tho 
Qui22Rodgers,ksea43,[u'ksea43'],I said best overall player 
Qui22Rodgers,,[u'J1Flight'],RT The people who ignore you now will somehow need you later 
Qui22Rodgers,,[u'Delta'],Stuck in Utah for 6hrsnever again will I fly 
Qui22Rodgers,,[],Edelman on stage mom who that is? The kicker? Me Naw the WR Mom I ain't never seen a WR look like thathaha 
Qui22Rodgers,,[],A crazy crazy sport 
Qui22Rodgers,J_Rodgers18,[u'J_Rodgers18'],who? 
Qui22Rodgers,ksea43,[u'ksea43'],let to them true blues rest lol 
Qui22Rodgers,Double_R16,[u'Double_R16'],what size? 
Qui22Rodgers,erickirbywilk,[u'eric_wilkerson'],Happy Bday Bruh 
Qui22Rodgers,,[],Finally got some sunshine 
Qui22Rodgers,Rom34Smith,[u'Rom34Smith'],my offseason record good against you boy lol 
Qui22Rodgers,Rom34Smith,[u'Rom34Smith'],During the season I didn't have timeBut now I got time cuzzz 
Qui22Rodgers,,[],HTX nights 
Qui22Rodgers,,[],Welcome 2 The OSU Fam 
Qui22Rodgers,,[u'Sauce_Walka102'],I'm 2 Legited 2 QuitedI'm 2 Legited 2 QuitedYea you heard that right bish I'm 2 Legited 2 Quited- 
Qui22Rodgers,Qui22Rodgers,[u'J_Pena23'],Say he's on hush now lol 
Qui22Rodgers,ksea43,[u'ksea43'],I hope you don't try and fly it 
Qui22Rodgers,,[],Braxton Miller to Oregon next yr? 
Qui22Rodgers,,[],VERY rarely you see Oregon not convert 3rd n 4th downs like this 
Qui22Rodgers,,[],Stuttering ass ref Haha 
Qui22Rodgers,,[],Ohio St defense is thrill 
Qui22Rodgers,,[],15 be running that thang 
Qui22Rodgers,BeaverWBB,[u'oregonstatewbb'],is the real deal 
Qui22Rodgers,,[],RT What a beautiful day in Lincoln There truly is no place like it Proud to be a part of the family 
Qui22Rodgers,DrakeSt_Cloud,[u'DrakeSt_Cloud'],just get yo leg better lol 
Qui22Rodgers,DrakeSt_Cloud,[u'DrakeSt_Cloud'],happy bday boy The countdown is here until the king comes home 
Qui22Rodgers,J_Rodgers18,[u'J_Rodgers18'],shit take that waist shaper off then 
Qui22Rodgers,,"[u'Coach_Riley', u'sj39']",RT Look who I found in Lincoln It's 
Qui22Rodgers,DrippinDuece,[u'J_Rodgers18'],yo bro sent me that ---&gt;&gt;@J_Rodgers18 
Qui22Rodgers,,"[u'LDokey', u'Qui22Rodgers']",RT HAPPY GOOD MORNING TO YOU QUIZZ HAVE A GREAT DAY GOD BLESS 
Qui22Rodgers,,[],GoodMorning Twitter Fam 
Qui22Rodgers,,[u'J_Rodgers18'],RT He made up for it 
Qui22Rodgers,,"[u'SoleCollector', u'DezBryant', u'_PO2345']",RT Air Jordan 7 PE for today (via 
Qui22Rodgers,,"[u'SoleCollector', u'hakeemnicks']",RT debuts a 'Colts' Air Jordan 7 PE for the playoffs 
Qui22Rodgers,,[],
Qui22Rodgers,amonbyars,[u'amonbyars'],the stepback was crucial &lt;-- Dang I hope he got his license n registration lol 
Qui22Rodgers,JonPowell81,"[u'JonPowell81', u'Qui22Rodgers']",Big Gold Rush fan myself I was just watching that 
Qui22Rodgers,,[u'AlaskanBushPPL'],One of my favorite shows right now 
Qui22Rodgers,,[],haha 
Qui22Rodgers,,[u'CockyTomBrady'],RT SEC is supposed to be the best conference in college football But that's none of my business 
Qui22Rodgers,Jgood_bgs,[u'Jgood_bgs'],Nick Saban retires &amp; Lives lavishly Lol 
Qui22Rodgers,,[],Bama punter is on point 
Qui22Rodgers,,[u'J_Rodgers18'],RT Ball game 
Qui22Rodgers,VegasDUCKfan58,[u'VegasDUCKfan58'],haha 
Qui22Rodgers,,[],Want the Ducks to win bc they're representing the PAC But by me going to OSU I can't do that Hope it's a good game tho 
Qui22Rodgers,,[],Happy Mutherf**kin New YearIt gets greater later 
Qui22Rodgers,,"[u'RandySaull', u'Qui22Rodgers']",RT Jackpot at XMAS 
Qui22Rodgers,ksea43,[u'ksea43'],heck yeah lol 
Qui22Rodgers,,"[u'FalconsCR', u'PatDiMarco42', u'Taps4America', u'BearPascoe', u'Qui22Rodgers']",RT treats families of to a shopping spree w/ &amp; 
Qui22Rodgers,,[u'Coach_Riley'],Congrats to on his new job Bittersweet but I know both sides have great things to come 
Qui22Rodgers,KBDeuce4,"[u'KBDeuce4', u'J_Rodgers18', u'LaMichaelJames', u'Qui22Rodgers']",bet good where he don't want to put in on this lol lol 
Qui22Rodgers,,"[u'BeaverAthletics', u'beavsvolleyball']",RT starts weekend off right with a 3-1 win over the Ducks 
Qui22Rodgers,,[],I hope everyone had a great Thanksgiving 
Qui22Rodgers,,[u'J_Rodgers18'],Who got the connect for the Doernbecher Retro 8s? didn't come thur for me this time Smh 
Qui22Rodgers,,[u'RandySaull'],Wishing You A Happy Bday 
Qui22Rodgers,,[],RT Happy Birthday To The Strongest Woman Out There Love Ya Mama 
Qui22Rodgers,,[],Great team win today It's all about coming together and blooming at the right time 
Qui22Rodgers,21savageeee,[],ok hope y'all can bring another football to the city 
Qui22Rodgers,21savageeee,[],who y'all got this week? 
Qui22Rodgers,J_Rodgers18,[u'J_Rodgers18'],he swole tho quon haha ready too bully someone in 
Qui22Rodgers,DrippinDuece,[],Basketball practice went smooth hahaha I bet 
Qui22Rodgers,,"[u'McDanielAndrew', u'Qui22Rodgers']",RT Find it pretty awesome that paid a visit to the Oregon school of the deaf 
Qui22Rodgers,,[],Who's going to the game tomorrow? 
Qui22Rodgers,trailblazers,[u'trailblazers'],game tonight 
Qui22Rodgers,DrakeSt_Cloud,[u'DrakeSt_Cloud'],Wish them GR boys a good game--too friendly lol 
Qui22Rodgers,,"[u'LAchong88', u'Qui22Rodgers']",RT Look who stopped by our artistic tent Two Atlanta Former Oregon State Beaver 
Qui22Rodgers,,"[u'FalconsMorgan', u'Qui22Rodgers']",RT Quizz can juggle 
Qui22Rodgers,,"[u'Qui22Rodgers', u'Cirque']",RT RBs Antone Smith and are behind the scenes of today 
Qui22Rodgers,,[],Smh Hail Mary Tho 
Qui22Rodgers,,[u'R_murphy25'],Great Return 
Qui22Rodgers,,[u'MTLAlouettes'],RT Rodgers continues his torrid run of terrorizing opposing defences the latest coming on that 18-yard TD reception MTL 15 
Qui22Rodgers,,"[u'MTLAlouettes', u'marshmadness16', u'J_Rodgers18']",RT Money 19-yard toss from Tanner Marsh (@marshmadness16) to Rodgers (@J_Rodgers18) for an first down Lets go 
Qui22Rodgers,,[u'J_Pena23'],Easy 250 in Madden from Haha 
Qui22Rodgers,ksea43,[u'ksea43'],hahaha He's The Real MVP 
Qui22Rodgers,thekailifornian,"[u'IkaikaHall', u'Qui22Rodgers', u'sj39', u'v8freeman']",
Qui22Rodgers,,[],
Qui22Rodgers,J_Rodgers18,"[u'J_Rodgers18', u'Qui22Rodgers']",I see boyz out there (I'm trying to get like you with the 82yd punt ret TD 
Qui22Rodgers,,[],Some things always seem impossible til its done 
Qui22Rodgers,,[],Boy hella boo boo in madden 
Qui22Rodgers,,[],Madden 15 on ps4 Who's down? Send yo gamertag 
M_Ryan02,,[],Much more fun playing with this guy than against him 
M_Ryan02,,[],On the field we may be opponents Being a is what brings us together 
M_Ryan02,,"[u'ESPNNFL', u'StuartScott']",Thanks to everyone for having me on countdown today Tough day for the espn family Rip you certainly will be missed 
M_Ryan02,,[],Certainly a disappointing year but I can't thank Mike Smith enough for all he has done the last seven 
M_Ryan02,,[],Nooooooo Defense has to come up big here 
M_Ryan02,,[u'CameronNewton'],Hoping is okay Thoughts and prayers with him today 
M_Ryan02,,[],Caption this 
M_Ryan02,,[u'sryan03'],RT Great win BC football 
M_Ryan02,ChrisMCameron,[u'ChrisMCameron'],good thing you stayed in that spot for Tyler's run Don't move 
M_Ryan02,,[],Lots of traveling this week My 2 road trip essentials Bose headphones and snacks 
M_Ryan02,,[],Ben's ready I'm ready 
M_Ryan02,,[],Good win BC 
M_Ryan02,,[u'jakematthews70'],RT In honor of Downs Syndrome Awareness Month I give a shout out to my favorite Falcons fan my beautiful sister Gwen ht 
M_Ryan02,,[],nyc 
M_Ryan02,,[],
M_Ryan02,,"[u'Bose', u'McIlroyRory']",On the eve of the ryder cup TBT thursday to my video shoot Channeling my inner 
M_Ryan02,,[],Thursday night 
M_Ryan02,,[],
M_Ryan02,,[],Let's go BC 
M_Ryan02,,[],
M_Ryan02,,[],Need a 3 and out to start the fourth quarter from the BC defense 
M_Ryan02,,[],Happy to be w to Loving my new headphones Who's your favorite new Falcon? 
M_Ryan02,,"[u'sryan03', u'PeteFrates3']",RT congrats to you and Julie on the arrival of your baby girl So happy for you both and your families Lots of love 
jskizzle72,,"[u'MrSilverScott', u'PropertyBrother']",RT One of these Jonathan Scotts is a &amp; the other plays for the Guesses? http 
jskizzle72,juliMjordan,[u'juliMjordan'],no problem 
jskizzle72,YNIC_DRE,[u'YNIC_DRE'],my pleasure 
jskizzle72,,[],Just ran into Jonathan Scott greatness everywhere 
jskizzle72,,[u'bydremack'],S/O to for the dope python Falcons hat got some J's that will set this off 
jskizzle72,,[],Watch me show my skills at for get tix now 
jskizzle72,Jsoriasis,"[u'Jsoriasis', u'jskizzle72']",My pleasure thank you very much and reggards from Jsoriasis 
jskizzle72,,"[u'Quiztory', u'iHeartRadio', u'jskizzle72']",RT with Jonathan Scott using 
jskizzle72,,[],I'm listening to TDIQ 1/22 Jonathan on This Day in Quiztory Radio 
jskizzle72,,[],I'm listening to TDIQ 1/22 Jonathan on This Day in Quiztory Radio 
jskizzle72,,"[u'Quiztory', u'jskizzle72']",RT THURSDAY NFL offensive tackle reads a narrative for us Tune in for his history lesson 
jskizzle72,,[],
jskizzle72,,[],
jskizzle72,,[],NFL player shares his 5 psoriasis tips 
jskizzle72,,[],NFL player shares his 5 psoriasis tips 
jskizzle72,,"[u'NPF', u'jskizzle72']",RT offensive tackle Jonathan Scott shares his 5 tips 
jskizzle72,,[],People always askWhy haven't you posted a pic of yourself when you were a kid? My response was 
jskizzle72,,[],'Bout to ink this one in as a W 
jskizzle72,,"[u'LaTonyaStory', u'jskizzle72']",RT ICYMI Client news- OT &amp; Optimist Club of Atlanta Teamed Up to Surprise Atlanta students 
jskizzle72,,[],Someone is gonna be pretty happy FYI my gift wrapping skills are BOSS 
jskizzle72,,"[u'BigBoi', u'jskizzle72', u'Big_Kidz']",RT Shout out &amp; signed by the entire Falcons team 
jskizzle72,,[u'BigBoi'],Great time with at stakonia studios Giving back to the kiddos Not to mention he's one of the 
jskizzle72,,[],A touching moment w/ a mother Count your blessings not your problems 
jskizzle72,,[],Welcome to LPS Consulting PR 2012 Sports Marketing &amp; PR 
jskizzle72,,[],NFL Player Jonathan Scott Teams Up with The Optimist Club of Atlanta to Bring Holiday Cheer to Scott Elementary 
jskizzle72,,[],NFL Player Jonathan Scott Teams Up with The Optimist Club of Atlanta to Bring Holiday Cheer to Scott Elementary 
jskizzle72,,"[u'LaTonyaStory', u'jskizzle72']",RT Excited about the great community work client is doing in ATL in just a short time w/ 
jskizzle72,,[],Headed to the office 
jskizzle72,,"[u'LaTonyaStory', u'jskizzle72']",RT I'm excited to welcome the newest LPS Consulting PR client Atlanta Falcons player 
Rom34Smith,,[],RT Dont get Distracted 
Rom34Smith,,"[u'TomRock_Newsday', u'JustinPugh']",RT will be on Who Wants To Be A Millionaire Friday playing for Shriners Hospital for Children 
Rom34Smith,,[],RT Best Basketball Head Coach Sweet 16 RT Jim Boeheim FAV Bo Ryan 
Rom34Smith,KeevisT,"[u'KeevisT', u'MelmanIDELIVER']",lets get it 
Rom34Smith,,[u'OLIE_7'],RT Do your Job 
Rom34Smith,,[u'DirtyDelaware'],RT I can't tell you how to get there but I'll give you directions 
Rom34Smith,,[],I won't stop grinding until God tells me too 
Rom34Smith,,[],People know when their wrong lol I just pray for em 
Rom34Smith,,[],The hay is never in the barn 
Rom34Smith,,[u'OLIE_7'],RT Militant mind set Complete the mission 
Rom34Smith,,"[u'SeanWSpoon56', u'LupeFiasco']",Shoutout to the big homie for putting me on with that album 
Rom34Smith,,[],How u gonna stop God's plan Demarcus Cousins 
Rom34Smith,CaptainKelz,[u'CaptainKelz'],exactly shut up chump 
Rom34Smith,chanjones55,[u'Chan95Jones'],slim answer them peoples in that group txt 
Rom34Smith,,[u'CoachWheat6'],RT The future belongs to those who prepare for it today Malcolm X 
Rom34Smith,TheRealSap,[u'TheRealSap'],yours is coming 
Rom34Smith,,"[u'davidcanter', u'TrainingMask']",RT Truly appreciate the guys taking such good care of me and the rest of 
Rom34Smith,,[],God is great but it's snakes on my soul plane 
Rom34Smith,The_Real_Shaad,[u'The_Real_Shaad'],lets get it 
Rom34Smith,,[],The hay is never in the barn 
Rom34Smith,,[],Love and forgiveness 
Rom34Smith,davidcanter,[u'davidcanter'],Its still Sunday Beyonc taking us to church 
Rom34Smith,AlfonsoFlores_,"[u'AlfonsoFlores_', u'Rom34Smith']",On a flight sitting behind 
Rom34Smith,,[u'Ballaslife410'],RT Stop overlooking the FIRST STATE 
Rom34Smith,,[u'Ballaslife410'],RT I just want the whole world to know its TALENT in DELAWARE 
Rom34Smith,AleahM8701,[u'AleahM8701'],miss you too lil sis 
Rom34Smith,,[],Success isn't owned its leased and rent is due every day GETREADY 
Rom34Smith,,[],The hay is never in the barn 
Rom34Smith,mayamorena_,[],Jealousy is just love and hate at the same time 
Rom34Smith,,[u'PhilDAbb'],RT Jim Boeheim asked if he runs a dirty program I don't give a shit what those people think 
Rom34Smith,,[],You know what they say about when Ya palms itch 
Rom34Smith,,[],RT Your Season is Here 
Rom34Smith,,[],Turn from evil and do good seek peace and pursue it 
Rom34Smith,,[u'LightsOutMorgan'],RT Rise&amp;Grind you wouldn't even know 
Rom34Smith,,[],Love the people who treat you right forgive those who don't just because you can 
Rom34Smith,,[],Life goes on 
Rom34Smith,,"[u'JustinPugh', u'CuseFootball']",RT Congrats to all the commits today Get ready to come work your tails off and win Welcome to the family we g 
Rom34Smith,DurellEskridge,[u'DurellEskridge'],lol being humble lil bro 
Rom34Smith,DurellEskridge,[u'DurellEskridge'],nah bro Dominican Republic 
Rom34Smith,DurellEskridge,[u'DurellEskridge'],BOOM 
Rom34Smith,,[],I know people slacking I'm on Ya heels trust me 
Rom34Smith,DurellEskridge,[u'DurellEskridge'],just grinding so I can be where I wanna be 
Rom34Smith,DurellEskridge,[u'DurellEskridge'],yup now it's time 
Rom34Smith,DurellEskridge,[u'DurellEskridge'],BIG 3 what's good bro I'm excited for you this next couple months is your time 
Rom34Smith,,[u'JayBrom96'],RT Don't know if I'm really a vacation guy i might have shot to far with this 5 day trip it's still a blessing tho 
Rom34Smith,,[],Congrats to everybody signing today 
Rom34Smith,KeevisT,[u'KeevisT'],welcome to America 
Rom34Smith,Ecrume_52,[u'Ecrume_52'],yup 
Rom34Smith,CarasikS,"[u'ScottCarasik', u'Oneway_Reedy', u'MartinoTheKid']",I pray I get any of the three I'm snapping necks back 
Rom34Smith,,[],I had dreams now they all coming true 
Rom34Smith,,[],Thank God every night 
Rom34Smith,,[u'CoachWheat6'],RT Surround yourself with people that you are not afraid to fail with 
Rom34Smith,KeevisT,[u'KeevisT'],man you hella foo 
Rom34Smith,,[],Stay Prayed Up 
Rom34Smith,,[],The hay is never in the barn 
Rom34Smith,ZackMolle,"[u'ZackMolle', u'BeckettWales']",lol George knows better 
Rom34Smith,,[],Those are real emotions 
Rom34Smith,,[u'TrainingMask'],Starting the offseason right thanks to 
Rom34Smith,,[],You either at the table or on the menu 
Rom34Smith,seattleslu,"[u'seattleslu', u'AdamOrangeman', u'Rom34Smith']",Love this Right Lets go 
Rom34Smith,BRedd_4,[u'BRedd_4'],I'm close to philly lol 
Rom34Smith,,[],Trust me you get what you give 
Rom34Smith,,[],It's disappointing what social networks has done to our lives or what we let social networks do to our lives 
Rom34Smith,,[],Team strong lol 
Rom34Smith,BeautyMarked_,[u'BeautyMarked_'],lol what I do 
Rom34Smith,BeautyMarked_,[u'BeautyMarked_'],
Rom34Smith,,[],I feel bad for these kids another great is about to retire Jeff Gordon I grew up and saw legends perform at their peak 
